Proxy,Protocol,Country,Country Code,Flag,Fraud Score,Risk,VPN,ISP
202.136.82.116:8099,HTTP,Indonesia,ID,🇮🇩,0,low,No,PT GIRI DATA SOLUSINDO
14.102.154.205:8080,HTTP,Indonesia,ID,🇮🇩,0,low,No,SKYLINE
36.64.162.194:8080,HTTP,Indonesia,ID,🇮🇩,0,low,No,PT. Telekomunikasi Indonesia
103.80.214.243:1111,HTTP,Indonesia,ID,🇮🇩,0,low,No,PT Redi Revolusi Digital Solusi
210.87.92.135:8080,HTTP,Indonesia,ID,🇮🇩,0,low,No,PT Indo Telemedia Solusi
210.87.125.57:8080,HTTP,Indonesia,ID,🇮🇩,0,low,No,CV Brawijaya Giga Network
202.180.21.213:80,HTTP,Indonesia,ID,🇮🇩,0,low,No,PT. HIPERNET INDODATA
160.19.18.209:8080,HTTP,Indonesia,ID,🇮🇩,0,low,No,PT Indo Telemedia Solusi
103.65.237.92:5678,HTTP,Indonesia,ID,🇮🇩,0,low,No,PT Berkah Solusi Teknologi Informasi
103.180.126.166:8080,HTTP,Indonesia,ID,🇮🇩,0,low,No,PT Alam Media Data
156.230.187.234:8081,HTTP,Indonesia,ID,🇮🇩,0,low,No,My Republic Indonesia
103.165.157.235:3125,HTTP,Indonesia,ID,🇮🇩,0,low,No,MEGADATA-ISP
103.156.75.246:8181,HTTP,Indonesia,ID,🇮🇩,0,low,No,PT Trika Global Media
103.181.183.136:80,HTTP,Indonesia,ID,🇮🇩,0,low,No,PT Delta Awan Angkasa
210.87.92.196:8080,HTTP,Indonesia,ID,🇮🇩,0,low,No,PT Indo Telemedia Solusi
103.76.107.2:8085,HTTP,Indonesia,ID,🇮🇩,0,low,No,PT Geka Solusi Utama
103.178.194.133:2016,HTTP,Indonesia,ID,🇮🇩,0,low,No,PT Jaringan Keluarga Bersama
103.39.51.156:1080,HTTP,Indonesia,ID,🇮🇩,0,low,No,PT. Mega Mentari Mandiri
103.217.217.35:8080,HTTP,Indonesia,ID,🇮🇩,0,low,No,PT. Infotama Lintas Global
103.122.64.222:8080,HTTP,Indonesia,ID,🇮🇩,0,low,No,PT. Jinom Network Indonesia
103.151.20.131:80,HTTP,Indonesia,ID,🇮🇩,0,low,No,Dinas Komunikasi dan Informatika Kota Makassar
103.126.87.175:53934,HTTP,Indonesia,ID,🇮🇩,0,low,No,PT. Rasi Bintang Perkasa
103.153.62.242:8181,HTTP,Indonesia,ID,🇮🇩,0,low,No,PT Ikhlas Cipta Teknologi
103.101.216.70:8080,HTTP,Indonesia,ID,🇮🇩,0,low,No,PT Duta Trans Nusantara Network
103.156.16.227:8080,HTTP,Indonesia,ID,🇮🇩,0,low,No,RSTNET
103.172.42.177:1111,HTTP,Indonesia,ID,🇮🇩,0,low,No,PT Media Solusi Sukses
103.171.161.96:9090,HTTP,Indonesia,ID,🇮🇩,0,low,No,MYREPUBLIC
103.180.126.77:8080,HTTP,Indonesia,ID,🇮🇩,0,low,No,PT Alam Media Data
210.79.140.183:8181,HTTP,Indonesia,ID,🇮🇩,0,low,No,PT Era Zia Sakti
103.46.11.92:8080,HTTP,Indonesia,ID,🇮🇩,0,low,No,"Lintas Data Prima, PT"
103.66.197.4:8080,HTTP,Indonesia,ID,🇮🇩,0,low,No,PT. Mora Telematika Indonesia
103.179.252.226:3128,HTTP,Indonesia,ID,🇮🇩,0,low,Yes,PT Pusaka Kreasi Mandiri
103.112.163.131:8080,HTTP,Indonesia,ID,🇮🇩,0,low,No,24AS
180.148.25.78:8080,HTTP,Indonesia,ID,🇮🇩,0,low,No,PT GIGA NETWORK INDONESIA
103.164.212.125:8080,HTTP,Indonesia,ID,🇮🇩,0,low,No,PT iForte Global Internet
9.154.224.203:8080,HTTP,Indonesia,ID,🇮🇩,0,low,No,PT Mora Telematika Indonesia TBK
103.247.14.222:8080,HTTP,Indonesia,ID,🇮🇩,0,low,No,TERABIT
117.18.16.73:8080,HTTP,Indonesia,ID,🇮🇩,0,low,Yes,PT ALUCIO
103.171.255.204:8080,HTTP,Indonesia,ID,🇮🇩,0,low,No,PT Zona Kolektif Indonesia
103.145.34.153:1111,HTTP,Indonesia,ID,🇮🇩,0,low,No,PT Lintas Data Multimedia
103.66.62.177:8080,HTTP,Indonesia,ID,🇮🇩,0,low,No,PT Buana Visualnet Sentra
103.106.79.98:8080,HTTP,Indonesia,ID,🇮🇩,0,low,No,PT Quantum Tera Multimedia
103.165.157.206:8088,HTTP,Indonesia,ID,🇮🇩,0,low,No,MEGADATA-ISP
36.93.163.219:8080,HTTP,Indonesia,ID,🇮🇩,0,low,No,Telekomunikasi Indonesia
117.102.86.146:8080,HTTP,Indonesia,ID,🇮🇩,0,low,No,BIZNET
45.198.10.47:1111,HTTP,Indonesia,ID,🇮🇩,0,low,No,PT Jaringan Lintas Artha
103.124.137.150:20,HTTP,Indonesia,ID,🇮🇩,0,low,No,Global Media Data Prima
103.68.215.57:8181,HTTP,Indonesia,ID,🇮🇩,0,low,No,PT Media Grasi Internet
103.147.247.193:8080,HTTP,Indonesia,ID,🇮🇩,0,low,No,PLBNET
103.78.113.34:8080,HTTP,Indonesia,ID,🇮🇩,0,low,No,MORATELINDO
202.58.77.73:8800,HTTP,Indonesia,ID,🇮🇩,0,low,No,PT Data Buana Nusantara
103.191.218.171:8080,HTTP,Indonesia,ID,🇮🇩,0,low,No,PT Replay Inti Media
103.165.155.195:8080,HTTP,Indonesia,ID,🇮🇩,0,low,No,PT Jaringan Keluarga Bersama
103.164.229.153:8080,HTTP,Indonesia,ID,🇮🇩,0,low,No,PT Muria Data Utama
103.144.18.33:9000,HTTP,Indonesia,ID,🇮🇩,0,low,No,PT Gasatek Bintang Nusantara
103.174.122.88:8080,HTTP,Indonesia,ID,🇮🇩,0,low,No,PT Jaya Sejahtra Nugraha
103.227.24.230:1080,HTTP,Indonesia,ID,🇮🇩,0,low,No,PT Sumber Data Indonesia
103.11.99.126:8080,HTTP,Indonesia,ID,🇮🇩,0,low,No,PT SKYLINE SEMESTA
103.156.75.41:8080,HTTP,Indonesia,ID,🇮🇩,0,low,No,PT Trika Global Media
103.191.169.148:8080,HTTP,Indonesia,ID,🇮🇩,0,low,No,PT Sugi Bintang Jaya
103.13.204.84:8082,HTTP,Indonesia,ID,🇮🇩,0,low,No,PT JARINGANKU SARANA NUSANTARA
157.66.5.36:8080,HTTP,Indonesia,ID,🇮🇩,0,low,No,PT Era Global Nusindo
38.183.145.248:3125,HTTP,Indonesia,ID,🇮🇩,0,low,No,PT Ikhlas Cipta Teknologi
9.154.221.133:8080,HTTP,Indonesia,ID,🇮🇩,0,low,No,PT Mora Telematika Indonesia TBK
103.180.123.103:8090,HTTP,Indonesia,ID,🇮🇩,0,low,No,PT Indo Telemedia Solusi
163.227.248.100:8818,HTTP,Indonesia,ID,🇮🇩,0,low,No,PT Rajasa Sinergi Komunikasi
103.193.145.3:8080,HTTP,Indonesia,ID,🇮🇩,0,low,No,PT Lintas Jaringan Nusantara
103.46.186.17:8090,HTTP,Indonesia,ID,🇮🇩,0,low,No,PT Air Lintas Komunikasi
103.227.187.177:6090,HTTP,Indonesia,ID,🇮🇩,0,low,No,PT Master Star Network
103.163.111.56:1111,HTTP,Indonesia,ID,🇮🇩,0,low,No,PT Galunggung Access Solutions
103.247.23.215:8080,HTTP,Indonesia,ID,🇮🇩,0,low,No,PT wifian Solution
58.147.189.90:3125,HTTP,Indonesia,ID,🇮🇩,0,low,No,PT Transhybrid Communication
113.192.12.30:8181,HTTP,Indonesia,ID,🇮🇩,0,low,No,PT Parsaoran Global Datatrans
103.75.96.70:8080,HTTP,Indonesia,ID,🇮🇩,0,low,No,MORATELINDO
103.234.31.79:8080,HTTP,Indonesia,ID,🇮🇩,0,low,No,PT Jenius Lintas Nusantara
110.232.92.49:8080,HTTP,Indonesia,ID,🇮🇩,0,low,No,PT. Media Antar Nusa
103.189.97.38:1080,HTTP,Indonesia,ID,🇮🇩,0,low,No,"Lintas Data Prima, PT"
157.20.100.194:8080,HTTP,Indonesia,ID,🇮🇩,0,low,No,PT Muria Global Network
223.25.110.216:3125,HTTP,Indonesia,ID,🇮🇩,0,low,No,SinergiNet
165.99.102.66:1452,HTTP,Indonesia,ID,🇮🇩,0,low,No,PT Digital Omni Telekomunikasi
103.163.103.69:6789,HTTP,Indonesia,ID,🇮🇩,0,low,No,PT Mamura Inter Media
103.169.130.130:8080,HTTP,Indonesia,ID,🇮🇩,0,low,No,PT Lancar Artha Media Data
103.208.102.1:8080,HTTP,Indonesia,ID,🇮🇩,0,low,No,PT Tidar Lintas Nusa
103.227.187.35:8080,HTTP,Indonesia,ID,🇮🇩,0,low,No,PT Master Star Network
160.19.18.127:8181,HTTP,Indonesia,ID,🇮🇩,0,low,No,PT Indo Telemedia Solusi
160.20.128.15:1080,HTTP,Indonesia,ID,🇮🇩,0,low,No,PT ASTI DIGITAL INDONESIA
103.191.254.1:7777,HTTP,Indonesia,ID,🇮🇩,0,low,No,PT Ayodya Data Internusa
103.154.152.62:8085,HTTP,Indonesia,ID,🇮🇩,0,low,No,MORATELINDONAP
154.19.39.151:8090,HTTP,Indonesia,ID,🇮🇩,0,low,No,PT Lintas Network Solusi
103.247.23.37:1111,HTTP,Indonesia,ID,🇮🇩,0,low,No,PT wifian Solution
180.211.93.104:8080,HTTP,Indonesia,ID,🇮🇩,0,low,No,"Kings Network Indonesia, PT"
103.153.149.62:8038,HTTP,Indonesia,ID,🇮🇩,0,low,No,JARINGANKU
103.59.45.249:8080,HTTP,Indonesia,ID,🇮🇩,0,low,No,PT INDONESIA TRANS NETWORK
103.175.84.6:80,HTTP,Indonesia,ID,🇮🇩,0,low,No,Proxy-registered
45.198.20.193:3125,HTTP,Indonesia,ID,🇮🇩,0,low,No,PT IKHLAS CIPTA TEKNOLOGI
103.189.250.47:8080,HTTP,Indonesia,ID,🇮🇩,0,low,No,PT Pandawa Lima Java Network
103.156.17.232:8818,HTTP,Indonesia,ID,🇮🇩,0,low,No,RSTNET
118.97.75.86:8080,HTTP,Indonesia,ID,🇮🇩,0,low,No,PT. TELKOM INDONESIA
103.189.110.49:3125,HTTP,Indonesia,ID,🇮🇩,0,low,No,PT Pratama Komunika Sejahtera
103.31.235.102:8080,HTTP,Indonesia,ID,🇮🇩,0,low,No,PT Usaha Adi Sanggoro
103.56.206.48:1604,HTTP,Indonesia,ID,🇮🇩,0,low,No,Argon Data Communication
161.248.206.196:8080,HTTP,Indonesia,ID,🇮🇩,0,low,No,PT Iktiar Doa Tawakal
103.159.195.222:8181,HTTP,Indonesia,ID,🇮🇩,0,low,No,PT Giga Digital Nusantara
157.66.174.228:8080,HTTP,Indonesia,ID,🇮🇩,0,low,No,PT Win Artha Mandiri
38.183.146.10:8080,HTTP,Indonesia,ID,🇮🇩,0,low,No,PT Ikhlas Cipta Teknologi
163.227.250.58:8080,HTTP,Indonesia,ID,🇮🇩,0,low,No,PT Media Central Access
103.106.219.115:7777,HTTP,Indonesia,ID,🇮🇩,0,low,No,PT. ARTHA LINTAS DATA MANDIRI
45.198.32.235:8085,HTTP,Indonesia,ID,🇮🇩,0,low,No,PT Global Media Data Prima
103.156.233.41:8080,HTTP,Indonesia,ID,🇮🇩,0,low,No,MULTIMEDIALINKTECH
103.233.152.18:8080,HTTP,Indonesia,ID,🇮🇩,0,low,No,BIZNET
38.46.214.177:8085,HTTP,Indonesia,ID,🇮🇩,0,low,Yes,PT. Usaha Adi Sanggoro
116.12.47.218:9595,HTTP,Indonesia,ID,🇮🇩,0,low,No,ADSNET
117.102.86.148:8080,HTTP,Indonesia,ID,🇮🇩,0,low,No,BIZNET
36.93.214.253:8080,HTTP,Indonesia,ID,🇮🇩,0,low,No,Telekomunikasi Indonesia
103.155.196.47:8080,HTTP,Indonesia,ID,🇮🇩,0,low,No,JEMBATANDATA
38.183.146.170:8090,HTTP,Indonesia,ID,🇮🇩,0,low,No,PT Ikhlas Cipta Teknologi
160.25.223.14:8181,HTTP,Indonesia,ID,🇮🇩,0,low,No,PT Telemedia Prima Nusantara
124.158.190.130:64999,HTTP,Indonesia,ID,🇮🇩,0,low,No,PT Jala Lintas Media
103.173.162.61:8080,HTTP,Indonesia,ID,🇮🇩,0,low,No,Paket Data Andal
36.64.86.11:8080,HTTP,Indonesia,ID,🇮🇩,0,low,No,PT. Telekomunikasi Indonesia
103.174.123.4:8090,HTTP,Indonesia,ID,🇮🇩,0,low,No,PT Jaya Sejahtra Nugraha
175.106.15.189:8080,HTTP,Indonesia,ID,🇮🇩,0,low,No,Quantum Dist Cyber
113.192.31.79:8099,HTTP,Indonesia,ID,🇮🇩,0,low,No,PT Indo Telemedia Solusi
103.97.140.226:8080,HTTP,Indonesia,ID,🇮🇩,0,low,No,PT Jembatan Data Pangrango
101.255.151.245:8080,HTTP,Indonesia,ID,🇮🇩,0,low,No,PT Remala Abadi
103.171.255.108:8080,HTTP,Indonesia,ID,🇮🇩,0,low,No,PT Zona Kolektif Indonesia
103.183.8.185:8080,HTTP,Indonesia,ID,🇮🇩,0,low,No,PT Cepat Multi Data
103.22.98.69:8080,HTTP,Indonesia,ID,🇮🇩,0,low,No,CV. KHALISTA GROUP
36.92.61.75:8080,HTTP,Indonesia,ID,🇮🇩,0,low,No,Telekomunikasi Indonesia
103.97.140.127:3125,HTTP,Indonesia,ID,🇮🇩,0,low,No,PT Jembatan Data Pangrango
103.147.247.191:8080,HTTP,Indonesia,ID,🇮🇩,0,low,No,PLBNET
103.178.21.104:3125,HTTP,Indonesia,ID,🇮🇩,0,low,No,PT Trisna Mega Abadi
175.158.63.166:1111,HTTP,Indonesia,ID,🇮🇩,0,low,No,CBNNAP
203.175.102.223:3128,HTTP,Indonesia,ID,🇮🇩,0,low,No,PT. Mitra Kita Brilian
103.193.145.185:8181,HTTP,Indonesia,ID,🇮🇩,0,low,No,PT Lintas Jaringan Nusantara
103.182.189.250:8080,HTTP,Indonesia,ID,🇮🇩,0,low,No,PT iForte Global Internet
103.153.191.151:8080,HTTP,Indonesia,ID,🇮🇩,0,low,No,WANET
103.106.78.193:7979,HTTP,Indonesia,ID,🇮🇩,0,low,No,PT Quantum Tera Multimedia
103.247.21.83:8446,HTTP,Indonesia,ID,🇮🇩,0,low,No,PT wifian Solution
36.64.193.226:8080,HTTP,Indonesia,ID,🇮🇩,0,low,No,PT. Telekomunikasi Indonesia
113.192.3.106:8567,HTTP,Indonesia,ID,🇮🇩,0,low,No,PT Boombas Carlo Medianet
103.18.78.35:8080,HTTP,Indonesia,ID,🇮🇩,0,low,No,PT Usaha Adi Sanggoro
103.169.255.201:6080,HTTP,Indonesia,ID,🇮🇩,0,low,No,PT Master Star Network
103.171.83.49:8080,HTTP,Indonesia,ID,🇮🇩,0,low,No,PT Multi Network Indonesia
103.156.16.189:8818,HTTP,Indonesia,ID,🇮🇩,0,low,No,RSTNET
103.94.10.254:8080,HTTP,Indonesia,ID,🇮🇩,0,low,No,PT Widya Intersat Nusantara
103.82.246.17:6080,HTTP,Indonesia,ID,🇮🇩,0,low,No,PT Master Star Network
180.211.93.105:8080,HTTP,Indonesia,ID,🇮🇩,0,low,No,"Kings Network Indonesia, PT"
113.192.31.90:8080,HTTP,Indonesia,ID,🇮🇩,0,low,No,PT Indo Telemedia Solusi
103.193.144.223:8080,HTTP,Indonesia,ID,🇮🇩,0,low,No,PT Lintas Jaringan Nusantara
103.180.126.114:8080,HTTP,Indonesia,ID,🇮🇩,0,low,No,PT Alam Media Data
160.20.38.58:3125,HTTP,Indonesia,ID,🇮🇩,0,low,No,PT SAMUDRA DIGITAL NETWORK
192.232.48.1:8181,HTTP,Indonesia,ID,🇮🇩,0,low,No,PT Axindo Infinitas Network
103.156.16.236:8818,HTTP,Indonesia,ID,🇮🇩,0,low,No,RSTNET
103.155.169.62:8299,HTTP,Indonesia,ID,🇮🇩,0,low,No,PT Arozak Bima Yudho Sangkara
103.122.0.52:8181,HTTP,Indonesia,ID,🇮🇩,0,low,No,PT. Java Digital Nusantara
103.46.8.61:8080,HTTP,Indonesia,ID,🇮🇩,0,low,No,PT JARINGANKU SARANA NUSANTARA
103.242.104.150:8080,HTTP,Indonesia,ID,🇮🇩,0,low,No,PT Lintas Jaringan Nusantara
101.255.107.33:8080,HTTP,Indonesia,ID,🇮🇩,0,low,No,PT Remala Abadi
103.141.180.254:80,HTTP,Indonesia,ID,🇮🇩,0,low,No,PT Indonesia Comnets Plus
103.247.15.103:9090,HTTP,Indonesia,ID,🇮🇩,0,low,No,PT SELARAS CITRA TERABIT
49.0.26.215:8087,HTTP,Indonesia,ID,🇮🇩,0,low,No,SIMS Jabar Banten Medianet
103.18.77.14:1111,HTTP,Indonesia,ID,🇮🇩,0,low,Yes,PT Usaha Adi Sanggoro
103.156.14.15:8080,HTTP,Indonesia,ID,🇮🇩,0,low,No,PT Lintas Jaringan Nusantara
103.184.180.135:2021,HTTP,Indonesia,ID,🇮🇩,0,low,No,"Lintas Data Prima, PT"
203.175.126.229:8000,HTTP,Indonesia,ID,🇮🇩,0,low,No,PT Cubiespot Pilar Data Nusantara
103.56.80.39:8080,HTTP,Indonesia,ID,🇮🇩,0,low,No,PT Jaringan Citra Mandiri
103.180.123.183:3125,HTTP,Indonesia,ID,🇮🇩,0,low,No,PT Indo Telemedia Solusi
103.159.96.119:8080,HTTP,Indonesia,ID,🇮🇩,0,low,No,PT Jinde Grup Indonesia
103.134.220.122:1080,HTTP,Indonesia,ID,🇮🇩,0,low,No,PT GLOBAL MEDIA PRATAMA SOLUSINDO
154.58.138.223:8080,HTTP,Indonesia,ID,🇮🇩,0,low,No,MEGADATA-ISP
103.172.71.135:3127,HTTP,Indonesia,ID,🇮🇩,0,low,No,AZNET
101.255.32.43:8080,HTTP,Indonesia,ID,🇮🇩,0,low,No,PT Remala Abadi
103.184.54.9:8080,HTTP,Indonesia,ID,🇮🇩,0,low,No,PT Proxi Jaringan Nusantara
103.171.255.170:8080,HTTP,Indonesia,ID,🇮🇩,0,low,No,PT Zona Kolektif Indonesia
103.171.183.245:8080,HTTP,Indonesia,ID,🇮🇩,0,low,No,PT Hayat Teknologi Informatika
43.252.236.158:8080,HTTP,Indonesia,ID,🇮🇩,0,low,No,NET
103.126.86.124:1080,HTTP,Indonesia,ID,🇮🇩,0,low,No,PT. Rasi Bintang Perkasa
157.15.67.49:8080,HTTP,Indonesia,ID,🇮🇩,0,low,No,TRITAMA
103.119.67.27:8080,HTTP,Indonesia,ID,🇮🇩,0,low,No,MYREPUBLIC
103.172.71.209:1080,HTTP,Indonesia,ID,🇮🇩,0,low,No,AZNET
121.101.129.97:8181,HTTP,Indonesia,ID,🇮🇩,0,low,No,PT SELARAS CITRA TERABIT
103.145.34.109:1111,HTTP,Indonesia,ID,🇮🇩,0,low,No,PT Lintas Data Multimedia
163.223.78.163:8080,HTTP,Indonesia,ID,🇮🇩,0,low,No,PT Big Network Indonesia
192.232.48.26:8181,HTTP,Indonesia,ID,🇮🇩,0,low,No,PT Axindo Infinitas Network
103.126.87.120:8082,HTTP,Indonesia,ID,🇮🇩,0,low,No,PT. Rasi Bintang Perkasa
103.156.248.60:8080,HTTP,Indonesia,ID,🇮🇩,0,low,No,Trans Media Telekomunikasi
103.180.118.99:8044,HTTP,Indonesia,ID,🇮🇩,0,low,No,PT Persada Data Multimedia
103.134.246.9:3172,HTTP,Indonesia,ID,🇮🇩,0,low,No,Wisuandha Network Globalindo
103.126.87.125:8090,HTTP,Indonesia,ID,🇮🇩,0,low,No,PT. Rasi Bintang Perkasa
182.253.110.130:8080,HTTP,Indonesia,ID,🇮🇩,0,low,No,BIZNET
103.255.132.210:1111,HTTP,Indonesia,ID,🇮🇩,0,low,No,Sarana Kawan Setia
103.179.252.235:3127,HTTP,Indonesia,ID,🇮🇩,0,low,Yes,PT Pusaka Kreasi Mandiri
103.172.249.62:8899,HTTP,Indonesia,ID,🇮🇩,0,low,No,PT. Fiber Networks Indonesia
101.255.117.138:2020,HTTP,Indonesia,ID,🇮🇩,0,low,No,PT Remala Abadi
103.160.202.174:3125,HTTP,Indonesia,ID,🇮🇩,0,low,No,PT Sembilan Mediadata Nusaraya
103.177.8.119:10133,HTTP,Indonesia,ID,🇮🇩,0,low,No,PT Helium Sinergi Telekomunikasi
43.252.106.66:8080,HTTP,Indonesia,ID,🇮🇩,0,low,No,PT Lintas Data Prima
103.189.249.140:1111,HTTP,Indonesia,ID,🇮🇩,0,low,No,PT Berkah Media Kusuma Vision
103.131.19.51:8080,HTTP,Indonesia,ID,🇮🇩,0,low,No,PT Global Media Data Prima
103.180.123.229:1080,HTTP,Indonesia,ID,🇮🇩,0,low,No,PT Indo Telemedia Solusi
45.198.32.207:8080,HTTP,Indonesia,ID,🇮🇩,0,low,No,PT Global Media Data Prima
192.232.48.21:8181,HTTP,Indonesia,ID,🇮🇩,0,low,No,PT Axindo Infinitas Network
103.165.157.37:3125,HTTP,Indonesia,ID,🇮🇩,0,low,No,MEGADATA-ISP
103.227.187.3:6090,HTTP,Indonesia,ID,🇮🇩,0,low,No,PT Master Star Network
27.50.29.226:8080,HTTP,Indonesia,ID,🇮🇩,0,low,No,PT. Mora Telematika Indonesia
103.68.214.131:2016,HTTP,Indonesia,ID,🇮🇩,0,low,No,PT Media Grasi Internet
103.191.254.141:8080,HTTP,Indonesia,ID,🇮🇩,0,low,No,PT Ayodya Data Internusa
103.169.26.114:8080,HTTP,Indonesia,ID,🇮🇩,0,low,No,PT Aplikanusa Lintasarta
103.36.10.63:3125,HTTP,Indonesia,ID,🇮🇩,0,low,No,PT Awinet Global Mandiri
103.147.118.240:8080,HTTP,Indonesia,ID,🇮🇩,0,low,No,PT.Bestcamp Prima Data
103.171.255.178:8080,HTTP,Indonesia,ID,🇮🇩,0,low,No,PT Zona Kolektif Indonesia
103.154.152.104:8090,HTTP,Indonesia,ID,🇮🇩,0,low,No,MORATELINDONAP
103.230.48.110:8082,HTTP,Indonesia,ID,🇮🇩,0,low,No,PT Mandala Lintas Nusa
103.167.31.155:8080,HTTP,Indonesia,ID,🇮🇩,0,low,No,PT iForte Global Internet
103.46.4.131:3125,HTTP,Indonesia,ID,🇮🇩,0,low,No,PT Akses Sentral Teknologi
160.22.134.39:1111,HTTP,Indonesia,ID,🇮🇩,0,low,No,PT GALAXY SINERGI NETWORK
103.188.168.69:8082,HTTP,Indonesia,ID,🇮🇩,0,low,No,PT Lintas Jaringan Nusantara
103.171.240.134:9595,HTTP,Indonesia,ID,🇮🇩,0,low,No,PT Abs Multimedia Indonesia
163.223.119.9:8085,HTTP,Indonesia,ID,🇮🇩,0,low,No,PT Dra Net Solution
103.193.144.97:3125,HTTP,Indonesia,ID,🇮🇩,0,low,No,PT Lintas Jaringan Nusantara
101.255.151.205:8181,HTTP,Indonesia,ID,🇮🇩,0,low,No,PT Remala Abadi
103.133.25.119:8080,HTTP,Indonesia,ID,🇮🇩,0,low,No,PT PHATRIA INTI PERSADA
103.126.87.112:1285,HTTP,Indonesia,ID,🇮🇩,0,low,No,PT. Rasi Bintang Perkasa
103.159.195.193:3125,HTTP,Indonesia,ID,🇮🇩,0,low,No,PT Giga Digital Nusantara
101.255.32.42:8080,HTTP,Indonesia,ID,🇮🇩,0,low,No,PT Remala Abadi
101.255.166.134:1111,HTTP,Indonesia,ID,🇮🇩,0,low,No,PT Remala Abadi
103.188.173.37:2211,HTTP,Indonesia,ID,🇮🇩,0,low,No,PT Satria Digital Media
103.161.131.110:8080,HTTP,Indonesia,ID,🇮🇩,0,low,No,PT Jaringan Internet Nusantara
202.47.185.180:8080,HTTP,Indonesia,ID,🇮🇩,0,low,No,PT Putra Garsel Interkoneksi
36.95.27.91:8080,HTTP,Indonesia,ID,🇮🇩,1,low,No,PT. Telekomunikasi Indonesia
36.88.170.170:8080,HTTP,Indonesia,ID,🇮🇩,1,low,No,PT. Telekomunikasi Indonesia
36.94.149.149:8090,HTTP,Indonesia,ID,🇮🇩,1,low,No,PT. Telekomunikasi Indonesia
36.66.121.131:8080,HTTP,Indonesia,ID,🇮🇩,3,low,No,Telekomunikasi Indonesia
202.165.47.90:55443,HTTP,Indonesia,ID,🇮🇩,6,low,No,Circlecom
103.125.36.120:8080,HTTP,Indonesia,ID,🇮🇩,6,low,No,PT. Eka Mas Republik
149.129.255.179:8018,HTTP,Indonesia,ID,🇮🇩,8,low,No,Alibaba.com Singapore E-Commerce Private Limited
202.138.242.31:9090,HTTP,Indonesia,ID,🇮🇩,20,medium,No,PT Melvar Lintasnusa
