Proxy,Protocol,Country,Country Code,Flag,Fraud Score,Risk,VPN,ISP
157.10.97.185:8080,HTTP,Indonesia,ID,🇮🇩,0,low,No,PT Lintas Jaringan Nusantara
103.14.2.138:2020,HTTP,Indonesia,ID,🇮🇩,0,low,No,MADA
103.39.75.123:8080,HTTP,Indonesia,ID,🇮🇩,0,low,No,PT. GOLDEN NETWORK NUSANTARA
192.232.48.26:8181,HTTP,Indonesia,ID,🇮🇩,0,low,No,PT Axindo Infinitas Network
202.169.250.148:8111,HTTP,Indonesia,ID,🇮🇩,0,low,No,PT. Rabik Bangun Pertiwi
103.179.252.235:3127,HTTP,Indonesia,ID,🇮🇩,0,low,Yes,PT Pusaka Kreasi Mandiri
103.156.248.60:8080,HTTP,Indonesia,ID,🇮🇩,0,low,No,Trans Media Telekomunikasi
43.252.237.163:1111,HTTP,Indonesia,ID,🇮🇩,0,low,No,PT Usaha Adi Sanggoro
103.255.132.210:1111,HTTP,Indonesia,ID,🇮🇩,0,low,No,Sarana Kawan Setia
103.172.249.62:8899,HTTP,Indonesia,ID,🇮🇩,0,low,No,PT. Fiber Networks Indonesia
36.92.199.158:8080,HTTP,Indonesia,ID,🇮🇩,0,low,No,PT. Telekomunikasi Indonesia
103.153.247.110:8080,HTTP,Indonesia,ID,🇮🇩,0,low,No,PRIMAHOME
103.227.187.3:6090,HTTP,Indonesia,ID,🇮🇩,0,low,No,PT Master Star Network
103.177.104.121:8080,HTTP,Indonesia,ID,🇮🇩,0,low,No,PT. Fiber Networks Indonesia
103.188.168.69:8082,HTTP,Indonesia,ID,🇮🇩,0,low,No,PT Lintas Jaringan Nusantara
101.255.209.182:1111,HTTP,Indonesia,ID,🇮🇩,0,low,No,PT Remala Abadi
103.158.253.162:1111,HTTP,Indonesia,ID,🇮🇩,0,low,No,Rapid Network
103.163.103.208:8080,HTTP,Indonesia,ID,🇮🇩,0,low,No,PT Mamura Inter Media
103.253.127.230:3125,HTTP,Indonesia,ID,🇮🇩,0,low,No,PT Media Akses Telematika
115.187.29.25:89,HTTP,Indonesia,ID,🇮🇩,0,low,No,PT Lintas Jaringan Mandiri
160.19.19.102:8080,HTTP,Indonesia,ID,🇮🇩,0,low,No,PT Indo Telemedia Solusi
103.75.84.212:3125,HTTP,Indonesia,ID,🇮🇩,0,low,No,MEGADATA
103.130.82.13:8282,HTTP,Indonesia,ID,🇮🇩,0,low,No,PT Central Digital Network
157.15.122.84:3125,HTTP,Indonesia,ID,🇮🇩,0,low,No,Nex+
160.25.196.5:3125,HTTP,Indonesia,ID,🇮🇩,0,low,No,PT Rnet Mitra Sentosa
103.133.25.119:8080,HTTP,Indonesia,ID,🇮🇩,0,low,No,PT PHATRIA INTI PERSADA
103.220.23.131:7777,HTTP,Indonesia,ID,🇮🇩,0,low,No,CV. LINTAS MEDIA
38.211.25.242:8080,HTTP,Indonesia,ID,🇮🇩,0,low,No,PT Putra Garsel Interkoneksi
45.198.20.18:3125,HTTP,Indonesia,ID,🇮🇩,0,low,No,PT IKHLAS CIPTA TEKNOLOGI
157.66.16.38:8070,HTTP,Indonesia,ID,🇮🇩,0,low,No,PT Mitra Mandiri Network
103.191.169.218:1111,HTTP,Indonesia,ID,🇮🇩,0,low,No,PT Sugi Bintang Jaya
103.161.131.110:8080,HTTP,Indonesia,ID,🇮🇩,0,low,No,PT Jaringan Internet Nusantara
202.58.77.194:8031,HTTP,Indonesia,ID,🇮🇩,0,low,No,PT Data Buana Nusantara
45.198.33.79:8080,HTTP,Indonesia,ID,🇮🇩,0,low,No,PT.Global Media Data Prima
36.50.56.147:8080,HTTP,Indonesia,ID,🇮🇩,0,low,No,PT Andromega Data Nusantara
103.76.108.8:8080,HTTP,Indonesia,ID,🇮🇩,0,low,No,PT Mahawira Nusantara Grup
103.166.159.115:1080,HTTP,Indonesia,ID,🇮🇩,0,low,No,PT Timor Lintas Nusantara
103.187.86.6:8183,HTTP,Indonesia,ID,🇮🇩,0,low,No,PT Satunol Digital Teknologi
103.126.87.203:8081,HTTP,Indonesia,ID,🇮🇩,0,low,No,PT. Rasi Bintang Perkasa
103.172.23.70:1111,HTTP,Indonesia,ID,🇮🇩,0,low,No,PT Tujuhlangit Lintas Nusantara
103.160.205.244:8181,HTTP,Indonesia,ID,🇮🇩,0,low,No,PRIME
103.105.76.10:3125,HTTP,Indonesia,ID,🇮🇩,0,low,No,PT. Garuda Media Telematika
103.153.149.18:8181,HTTP,Indonesia,ID,🇮🇩,0,low,No,JARINGANKU
210.87.125.58:1080,HTTP,Indonesia,ID,🇮🇩,0,low,No,CV Brawijaya Giga Network
103.175.240.65:7777,HTTP,Indonesia,ID,🇮🇩,0,low,No,LDP
163.223.78.137:8080,HTTP,Indonesia,ID,🇮🇩,0,low,No,PT Big Network Indonesia
103.122.64.139:8085,HTTP,Indonesia,ID,🇮🇩,0,low,No,PT. Jinom Network Indonesia
36.64.241.218:8080,HTTP,Indonesia,ID,🇮🇩,0,low,No,PT. Telekomunikasi Indonesia
103.253.127.78:3125,HTTP,Indonesia,ID,🇮🇩,0,low,No,PT Media Akses Telematika
45.198.32.139:8080,HTTP,Indonesia,ID,🇮🇩,0,low,No,PT Global Media Data Prima
103.71.162.46:8181,HTTP,Indonesia,ID,🇮🇩,0,low,No,PT. Menaksopal Link Nusantara
38.211.24.242:8080,HTTP,Indonesia,ID,🇮🇩,0,low,No,PT Putra Garsel Interkoneksi
103.26.176.187:8181,HTTP,Indonesia,ID,🇮🇩,0,low,No,PT Lintas Jaringan Nusantara
103.141.150.147:8080,HTTP,Indonesia,ID,🇮🇩,0,low,No,PRIMACOM
103.156.96.242:8088,HTTP,Indonesia,ID,🇮🇩,0,low,No,PT Karya Panca Telekomunikasi
103.155.168.162:8299,HTTP,Indonesia,ID,🇮🇩,0,low,No,PT Arozak Bima Yudho Sangkara
45.198.20.5:3125,HTTP,Indonesia,ID,🇮🇩,0,low,No,PT IKHLAS CIPTA TEKNOLOGI
103.178.2.72:8818,HTTP,Indonesia,ID,🇮🇩,0,low,No,RSTNET
103.162.221.3:8080,HTTP,Indonesia,ID,🇮🇩,0,low,No,PT Trisari Data Indonusa
103.122.64.232:8080,HTTP,Indonesia,ID,🇮🇩,0,low,No,PT. Jinom Network Indonesia
175.158.44.21:3125,HTTP,Indonesia,ID,🇮🇩,0,low,No,CBNNAP
103.65.237.92:5678,HTTP,Indonesia,ID,🇮🇩,0,low,No,PT Berkah Solusi Teknologi Informasi
165.99.194.32:8085,HTTP,Indonesia,ID,🇮🇩,0,low,No,PT Network Bumi Saridin
103.160.205.51:8080,HTTP,Indonesia,ID,🇮🇩,0,low,No,PRIME
114.9.25.74:8080,HTTP,Indonesia,ID,🇮🇩,0,low,No,PT. INDOSAT Tbk
103.80.214.188:8080,HTTP,Indonesia,ID,🇮🇩,0,low,No,PT Redi Revolusi Digital Solusi
103.247.13.134:8080,HTTP,Indonesia,ID,🇮🇩,0,low,No,TERABIT
203.2.151.21:8080,HTTP,Indonesia,ID,🇮🇩,0,low,No,PT BARAYA BARENG SADULUR
103.156.75.243:3125,HTTP,Indonesia,ID,🇮🇩,0,low,No,PT Trika Global Media
202.58.77.239:8080,HTTP,Indonesia,ID,🇮🇩,0,low,No,PT Data Buana Nusantara
103.76.107.2:8085,HTTP,Indonesia,ID,🇮🇩,0,low,No,PT Geka Solusi Utama
103.90.67.46:8080,HTTP,Indonesia,ID,🇮🇩,0,low,No,PT Rajawali Bintang Cemerlang Telkomedia
103.179.180.182:3128,HTTP,Indonesia,ID,🇮🇩,0,low,No,PT Karya Aneka Persada
103.181.183.136:80,HTTP,Indonesia,ID,🇮🇩,0,low,No,PT Delta Awan Angkasa
160.19.16.101:8181,HTTP,Indonesia,ID,🇮🇩,0,low,No,PT Media Balai Nusa
139.255.94.123:39635,HTTP,Indonesia,ID,🇮🇩,0,low,No,PT. LINKNET
103.203.233.162:8080,HTTP,Indonesia,ID,🇮🇩,0,low,No,PT Inti Data Guna
103.156.86.129:8080,HTTP,Indonesia,ID,🇮🇩,0,low,No,PT Chacha Networking System
103.208.102.93:1080,HTTP,Indonesia,ID,🇮🇩,0,low,No,PT Tidar Lintas Nusa
43.252.158.170:8989,HTTP,Indonesia,ID,🇮🇩,0,low,No,PT Blip Integrator Provider
9.154.224.113:8080,HTTP,Indonesia,ID,🇮🇩,0,low,No,PT Mora Telematika Indonesia TBK
113.192.30.27:7777,HTTP,Indonesia,ID,🇮🇩,0,low,No,PT Indo Telemedia Solusi
165.101.43.67:8080,HTTP,Indonesia,ID,🇮🇩,0,low,No,PT Lintas Jaringan Nusantara
38.183.146.57:8080,HTTP,Indonesia,ID,🇮🇩,0,low,Yes,PT Ikhlas Cipta Teknologi
103.10.60.178:8080,HTTP,Indonesia,ID,🇮🇩,0,low,No,PT Hipernet Indodata
202.180.21.213:80,HTTP,Indonesia,ID,🇮🇩,0,low,No,PT. HIPERNET INDODATA
103.151.20.131:80,HTTP,Indonesia,ID,🇮🇩,0,low,No,Dinas Komunikasi dan Informatika Kota Makassar
103.172.120.102:8097,HTTP,Indonesia,ID,🇮🇩,0,low,No,PT Digital Akses Nusantara
103.18.77.69:1080,HTTP,Indonesia,ID,🇮🇩,0,low,No,PT Usaha Adi Sanggoro
103.88.211.163:8080,HTTP,Indonesia,ID,🇮🇩,0,low,No,ICONPLN
103.194.175.51:7777,HTTP,Indonesia,ID,🇮🇩,0,low,No,MYNET
103.193.144.41:8080,HTTP,Indonesia,ID,🇮🇩,0,low,No,PT Lintas Jaringan Nusantara
38.46.214.173:8080,HTTP,Indonesia,ID,🇮🇩,0,low,No,PT. Usaha Adi Sanggoro
103.180.123.103:8090,HTTP,Indonesia,ID,🇮🇩,0,low,No,PT Indo Telemedia Solusi
103.151.246.22:8081,HTTP,Indonesia,ID,🇮🇩,0,low,No,MANAKARRANET
103.164.229.153:8080,HTTP,Indonesia,ID,🇮🇩,0,low,No,PT Muria Data Utama
103.191.254.1:7777,HTTP,Indonesia,ID,🇮🇩,0,low,No,PT Ayodya Data Internusa
103.156.15.14:8080,HTTP,Indonesia,ID,🇮🇩,0,low,No,PT Lintas Jaringan Nusantara
118.99.124.80:8080,HTTP,Indonesia,ID,🇮🇩,0,low,No,Biznet Metronet
103.188.168.75:3125,HTTP,Indonesia,ID,🇮🇩,0,low,No,PT Lintas Jaringan Nusantara
202.73.27.106:8080,HTTP,Indonesia,ID,🇮🇩,0,low,No,PT. Usaha Adisanggoro
157.15.40.250:7777,HTTP,Indonesia,ID,🇮🇩,0,low,No,TRISARI
103.188.51.50:3125,HTTP,Indonesia,ID,🇮🇩,0,low,No,PRIMACOM
103.181.255.105:8080,HTTP,Indonesia,ID,🇮🇩,0,low,No,PT Giga Digital Nusantara
103.133.61.53:8080,HTTP,Indonesia,ID,🇮🇩,0,low,No,TLINK
103.152.239.37:1080,HTTP,Indonesia,ID,🇮🇩,0,low,No,APRIN
103.188.169.170:8080,HTTP,Indonesia,ID,🇮🇩,0,low,No,PT Lintas Jaringan Nusantara
182.253.143.34:8080,HTTP,Indonesia,ID,🇮🇩,0,low,No,Biznet Networks
103.139.126.211:8080,HTTP,Indonesia,ID,🇮🇩,0,low,No,PT. MITRACOM SOLUSI TEKNOLOGI
103.173.141.3:8080,HTTP,Indonesia,ID,🇮🇩,0,low,No,DIAZANETWORKS
103.172.42.177:1111,HTTP,Indonesia,ID,🇮🇩,0,low,No,PT Media Solusi Sukses
38.46.214.177:8085,HTTP,Indonesia,ID,🇮🇩,0,low,Yes,PT. Usaha Adi Sanggoro
103.132.52.20:8080,HTTP,Indonesia,ID,🇮🇩,0,low,No,PT Adeaksa Indo Jayatama
103.94.251.91:8085,HTTP,Indonesia,ID,🇮🇩,0,low,Yes,PT Centronet Data Indonesia
103.133.24.75:8080,HTTP,Indonesia,ID,🇮🇩,0,low,No,PT PHATRIA INTI PERSADA
202.136.83.167:8090,HTTP,Indonesia,ID,🇮🇩,0,low,No,PT GIRI DATA SOLUSINDO
103.191.218.171:8080,HTTP,Indonesia,ID,🇮🇩,0,low,No,PT Replay Inti Media
103.19.78.242:1080,HTTP,Indonesia,ID,🇮🇩,0,low,No,PT Persada Data Multimedia
103.68.215.57:8181,HTTP,Indonesia,ID,🇮🇩,0,low,No,PT Media Grasi Internet
103.110.10.174:3300,HTTP,Indonesia,ID,🇮🇩,0,low,No,PT Citra Jelajah Informatika
103.171.183.218:8080,HTTP,Indonesia,ID,🇮🇩,0,low,No,PT Hayat Teknologi Informatika
160.20.39.3:3125,HTTP,Indonesia,ID,🇮🇩,0,low,No,PT SAMUDRA DIGITAL NETWORK
157.66.50.55:8080,HTTP,Indonesia,ID,🇮🇩,0,low,No,PT BARAYA TELEKOMUNIKASI INDONESIA
103.106.112.166:1234,HTTP,Indonesia,ID,🇮🇩,0,low,No,SMSNET
121.101.133.220:7777,HTTP,Indonesia,ID,🇮🇩,0,low,No,PT SELARAS CITRA TERABIT
36.95.142.35:8080,HTTP,Indonesia,ID,🇮🇩,0,low,No,Telekomunikasi Indonesia
103.188.169.93:8080,HTTP,Indonesia,ID,🇮🇩,0,low,No,PT Lintas Jaringan Nusantara
101.255.209.158:8181,HTTP,Indonesia,ID,🇮🇩,0,low,No,PT Remala Abadi
113.192.30.87:8800,HTTP,Indonesia,ID,🇮🇩,0,low,No,PT Indo Telemedia Solusi
103.11.99.126:8080,HTTP,Indonesia,ID,🇮🇩,0,low,No,PT SKYLINE SEMESTA
103.172.23.90:1080,HTTP,Indonesia,ID,🇮🇩,0,low,No,PT Tujuhlangit Lintas Nusantara
103.141.150.191:8080,HTTP,Indonesia,ID,🇮🇩,0,low,No,PRIMACOM
210.87.74.71:8080,HTTP,Indonesia,ID,🇮🇩,0,low,No,PT.Global Media Data Prima
38.46.214.193:1080,HTTP,Indonesia,ID,🇮🇩,0,low,No,PT. Usaha Adi Sanggoro
103.169.255.205:8080,HTTP,Indonesia,ID,🇮🇩,0,low,No,PT Master Star Network
103.179.183.223:8089,HTTP,Indonesia,ID,🇮🇩,0,low,No,SINARKENCANA
103.76.109.167:443,HTTP,Indonesia,ID,🇮🇩,0,low,No,PT Mahawira Nusantara Grup
103.156.17.139:8818,HTTP,Indonesia,ID,🇮🇩,0,low,No,RSTNET
36.91.148.36:8080,HTTP,Indonesia,ID,🇮🇩,1,low,No,PT. Telekomunikasi Indonesia
36.88.150.66:8080,HTTP,Indonesia,ID,🇮🇩,1,low,No,PT. Telekomunikasi Indonesia
36.92.24.12:9100,HTTP,Indonesia,ID,🇮🇩,1,low,No,PT. Telekomunikasi Indonesia
36.95.208.10:8080,HTTP,Indonesia,ID,🇮🇩,1,low,No,PT. Telekomunikasi Indonesia
36.95.27.91:8080,HTTP,Indonesia,ID,🇮🇩,1,low,No,PT. Telekomunikasi Indonesia
36.94.39.146:8080,HTTP,Indonesia,ID,🇮🇩,1,low,No,PT. Telekomunikasi Indonesia
36.94.246.17:8080,HTTP,Indonesia,ID,🇮🇩,1,low,No,PT. Telekomunikasi Indonesia
180.251.255.107:8080,HTTP,Indonesia,ID,🇮🇩,3,low,No,Telekomunikasi Indonesia
103.125.56.83:8080,HTTP,Indonesia,ID,🇮🇩,6,low,No,PT. Eka Mas Republik
103.121.22.192:8080,HTTP,Indonesia,ID,🇮🇩,6,low,No,PT. Eka Mas Republik
