Proxy,Protocol,Country,Country Code,Flag,Fraud Score,Risk,VPN,ISP
103.19.78.125:7777,HTTP,Indonesia,ID,🇮🇩,0,low,No,PT Persada Data Multimedia
114.8.131.181:8080,HTTP,Indonesia,ID,🇮🇩,0,low,No,PT. INDOSAT Tbk
103.56.205.84:8080,HTTP,Indonesia,ID,🇮🇩,0,low,No,Argon Data Communication
103.192.174.154:8080,HTTP,Indonesia,ID,🇮🇩,0,low,No,PT JKB Telematika Indonesia
103.165.237.195:3128,HTTP,Indonesia,ID,🇮🇩,0,low,No,PT iForte Global Internet
103.217.224.75:3125,HTTP,Indonesia,ID,🇮🇩,0,low,No,PT Nesta Indo Media
103.231.236.235:8182,HTTP,Indonesia,ID,🇮🇩,0,low,No,PT Level Indodata Teknologi
103.242.105.111:8080,HTTP,Indonesia,ID,🇮🇩,0,low,No,PT Lintas Jaringan Nusantara
157.66.16.38:8070,HTTP,Indonesia,ID,🇮🇩,0,low,No,PT Mitra Mandiri Network
103.106.79.98:8080,HTTP,Indonesia,ID,🇮🇩,0,low,No,PT Quantum Tera Multimedia
103.88.211.163:8080,HTTP,Indonesia,ID,🇮🇩,0,low,No,ICONPLN
182.253.143.34:8080,HTTP,Indonesia,ID,🇮🇩,0,low,No,Biznet Networks
110.232.85.86:6060,HTTP,Indonesia,ID,🇮🇩,0,low,No,PT Mandala Lintas Nusa
103.76.12.158:8080,HTTP,Indonesia,ID,🇮🇩,0,low,No,PT Mora Telematika Indonesia
103.18.77.14:1111,HTTP,Indonesia,ID,🇮🇩,0,low,Yes,PT Usaha Adi Sanggoro
103.154.222.58:1111,HTTP,Indonesia,ID,🇮🇩,0,low,No,MORATELINDONAP
103.82.246.17:6080,HTTP,Indonesia,ID,🇮🇩,0,low,No,PT Master Star Network
103.101.216.70:8080,HTTP,Indonesia,ID,🇮🇩,0,low,No,PT Duta Trans Nusantara Network
101.255.106.33:1452,HTTP,Indonesia,ID,🇮🇩,0,low,No,PT Remala Abadi
103.10.60.178:8080,HTTP,Indonesia,ID,🇮🇩,0,low,Yes,PT Hipernet Indodata
157.20.100.194:8080,HTTP,Indonesia,ID,🇮🇩,0,low,No,PT Muria Global Network
103.181.183.136:80,HTTP,Indonesia,ID,🇮🇩,0,low,No,PT Delta Awan Angkasa
103.247.22.84:8080,HTTP,Indonesia,ID,🇮🇩,0,low,No,PT wifian Solution
160.19.19.18:8080,HTTP,Indonesia,ID,🇮🇩,0,low,No,PT Indo Telemedia Solusi
103.191.165.171:8181,HTTP,Indonesia,ID,🇮🇩,0,low,No,PT Sakti Wijaya Network
103.132.41.198:7777,HTTP,Indonesia,ID,🇮🇩,0,low,No,PT Kalimasada Inti Sarana
103.68.215.45:8080,HTTP,Indonesia,ID,🇮🇩,0,low,No,PT Media Grasi Internet
103.163.103.69:6789,HTTP,Indonesia,ID,🇮🇩,0,low,No,PT Mamura Inter Media
103.153.190.43:8080,HTTP,Indonesia,ID,🇮🇩,0,low,No,WANET
160.191.192.45:8090,HTTP,Indonesia,ID,🇮🇩,0,low,No,PT Sigma Data Nusa
113.192.31.164:3127,HTTP,Indonesia,ID,🇮🇩,0,low,No,PT Indo Telemedia Solusi
103.65.237.92:5678,HTTP,Indonesia,ID,🇮🇩,0,low,No,PT Berkah Solusi Teknologi Informasi
38.183.146.10:8080,HTTP,Indonesia,ID,🇮🇩,0,low,No,PT Ikhlas Cipta Teknologi
103.55.22.52:8090,HTTP,Indonesia,ID,🇮🇩,0,low,No,PT General Media Network
103.39.75.123:8080,HTTP,Indonesia,ID,🇮🇩,0,low,No,PT. GOLDEN NETWORK NUSANTARA
103.135.226.66:8080,HTTP,Indonesia,ID,🇮🇩,0,low,No,SUPERCORRIDOR
103.242.104.150:8080,HTTP,Indonesia,ID,🇮🇩,0,low,No,PT Lintas Jaringan Nusantara
103.184.67.117:8181,HTTP,Indonesia,ID,🇮🇩,0,low,No,PT Siber Tech Indonesia
101.255.167.242:6767,HTTP,Indonesia,ID,🇮🇩,0,low,No,PT Remala Abadi
103.1.51.177:8181,HTTP,Indonesia,ID,🇮🇩,0,low,No,PT. PRATAMA HASTA UTAMA SOLUSINDO
157.20.207.29:8080,HTTP,Indonesia,ID,🇮🇩,0,low,No,PT Erajaya Telco Indonesia
103.180.122.64:8080,HTTP,Indonesia,ID,🇮🇩,0,low,No,PT Indo Telemedia Solusi
103.166.159.231:8080,HTTP,Indonesia,ID,🇮🇩,0,low,No,PT Timor Lintas Nusantara
163.227.248.100:8818,HTTP,Indonesia,ID,🇮🇩,0,low,No,PT Rajasa Sinergi Komunikasi
103.179.252.153:8181,HTTP,Indonesia,ID,🇮🇩,0,low,No,PT Pusaka Kreasi Mandiri
103.176.98.226:3088,HTTP,Indonesia,ID,🇮🇩,0,low,No,Dhoho ISP
103.126.87.175:53934,HTTP,Indonesia,ID,🇮🇩,0,low,No,PT. Rasi Bintang Perkasa
210.87.92.135:8080,HTTP,Indonesia,ID,🇮🇩,0,low,No,PT Indo Telemedia Solusi
103.177.8.133:1111,HTTP,Indonesia,ID,🇮🇩,0,low,No,PT Helium Sinergi Telekomunikasi
163.223.78.163:8080,HTTP,Indonesia,ID,🇮🇩,0,low,No,PT Big Network Indonesia
103.172.121.61:7778,HTTP,Indonesia,ID,🇮🇩,0,low,No,PT Digital Akses Nusantara
103.153.149.59:8034,HTTP,Indonesia,ID,🇮🇩,0,low,No,JARINGANKU
157.66.174.228:8080,HTTP,Indonesia,ID,🇮🇩,0,low,No,PT Win Artha Mandiri
9.154.224.113:8080,HTTP,Indonesia,ID,🇮🇩,0,low,No,PT Mora Telematika Indonesia TBK
101.255.211.90:8080,HTTP,Indonesia,ID,🇮🇩,0,low,No,PT Remala Abadi
160.19.19.122:8090,HTTP,Indonesia,ID,🇮🇩,0,low,No,PT Indo Telemedia Solusi
103.173.138.171:8080,HTTP,Indonesia,ID,🇮🇩,0,low,No,PT Serayu Multi Connection
165.99.151.246:10001,HTTP,Indonesia,ID,🇮🇩,0,low,No,PT Win Akselerasi Net Indonesia
121.101.130.137:8080,HTTP,Indonesia,ID,🇮🇩,0,low,No,PT SELARAS CITRA TERABIT
110.92.72.202:8080,HTTP,Indonesia,ID,🇮🇩,0,low,No,NEXIS
103.172.197.186:8080,HTTP,Indonesia,ID,🇮🇩,0,low,No,PT Cahaya Solusindo Internusa
43.252.107.217:8080,HTTP,Indonesia,ID,🇮🇩,0,low,No,PT Lintas Data Prima
36.92.106.41:8080,HTTP,Indonesia,ID,🇮🇩,0,low,No,Telekomunikasi Indonesia
103.247.22.77:4357,HTTP,Indonesia,ID,🇮🇩,0,low,No,PT wifian Solution
210.87.125.58:1080,HTTP,Indonesia,ID,🇮🇩,0,low,No,CV Brawijaya Giga Network
157.15.186.71:8080,HTTP,Indonesia,ID,🇮🇩,0,low,No,HAPPYINET
103.161.130.157:8080,HTTP,Indonesia,ID,🇮🇩,0,low,No,PT Jaringan Internet Nusantara
103.183.8.135:8080,HTTP,Indonesia,ID,🇮🇩,0,low,No,PT Cepat Multi Data
203.2.151.21:8080,HTTP,Indonesia,ID,🇮🇩,0,low,No,PT BARAYA BARENG SADULUR
103.177.8.119:10103,HTTP,Indonesia,ID,🇮🇩,0,low,No,PT Helium Sinergi Telekomunikasi
103.247.13.134:8080,HTTP,Indonesia,ID,🇮🇩,0,low,No,TERABIT
103.156.57.135:9988,HTTP,Indonesia,ID,🇮🇩,0,low,No,PT Filltech Antar Nusa
157.20.253.165:8080,HTTP,Indonesia,ID,🇮🇩,0,low,No,PT.Global Media Data Prima
103.227.187.11:6090,HTTP,Indonesia,ID,🇮🇩,0,low,No,PT Master Star Network
103.171.255.108:8080,HTTP,Indonesia,ID,🇮🇩,0,low,No,PT Zona Kolektif Indonesia
103.71.162.41:8080,HTTP,Indonesia,ID,🇮🇩,0,low,No,PT. Menaksopal Link Nusantara
121.101.129.97:8181,HTTP,Indonesia,ID,🇮🇩,0,low,No,PT SELARAS CITRA TERABIT
36.92.104.123:8000,HTTP,Indonesia,ID,🇮🇩,0,low,No,Telekomunikasi Indonesia
157.20.253.163:8080,HTTP,Indonesia,ID,🇮🇩,0,low,No,PT.Global Media Data Prima
103.171.83.23:7777,HTTP,Indonesia,ID,🇮🇩,0,low,Yes,PT Multi Network Indonesia
202.58.77.73:8800,HTTP,Indonesia,ID,🇮🇩,0,low,No,PT Data Buana Nusantara
103.124.137.150:20,HTTP,Indonesia,ID,🇮🇩,0,low,No,Global Media Data Prima
103.247.15.103:9090,HTTP,Indonesia,ID,🇮🇩,0,low,No,PT SELARAS CITRA TERABIT
103.191.169.218:1111,HTTP,Indonesia,ID,🇮🇩,0,low,No,PT Sugi Bintang Jaya
157.66.50.125:1111,HTTP,Indonesia,ID,🇮🇩,0,low,No,PT BARAYA TELEKOMUNIKASI INDONESIA
223.25.110.216:3125,HTTP,Indonesia,ID,🇮🇩,0,low,No,SinergiNet
103.133.61.165:3168,HTTP,Indonesia,ID,🇮🇩,0,low,No,TLINK
103.147.247.169:8080,HTTP,Indonesia,ID,🇮🇩,0,low,No,PLBNET
103.170.22.44:8080,HTTP,Indonesia,ID,🇮🇩,0,low,No,PT Puskomedia Indonesia Kreatif
103.170.100.98:8080,HTTP,Indonesia,ID,🇮🇩,0,low,No,Subnet Data Nusantara
103.214.251.66:8080,HTTP,Indonesia,ID,🇮🇩,0,low,No,PT Bittara Interkoneksi Nusantara
103.166.33.88:8080,HTTP,Indonesia,ID,🇮🇩,0,low,No,PT Daniswara Citra Informatika
103.141.150.191:8080,HTTP,Indonesia,ID,🇮🇩,0,low,No,PRIMACOM
103.46.8.102:8080,HTTP,Indonesia,ID,🇮🇩,0,low,No,PT JARINGANKU SARANA NUSANTARA
157.15.40.250:7777,HTTP,Indonesia,ID,🇮🇩,0,low,No,TRISARI
103.139.126.211:8080,HTTP,Indonesia,ID,🇮🇩,0,low,No,PT. MITRACOM SOLUSI TEKNOLOGI
103.156.17.171:8181,HTTP,Indonesia,ID,🇮🇩,0,low,No,RSTNET
103.122.64.232:8080,HTTP,Indonesia,ID,🇮🇩,0,low,No,PT. Jinom Network Indonesia
103.169.254.65:6080,HTTP,Indonesia,ID,🇮🇩,0,low,Yes,PT Master Star Network
103.179.252.235:3127,HTTP,Indonesia,ID,🇮🇩,0,low,No,PT Pusaka Kreasi Mandiri
160.19.18.29:8080,HTTP,Indonesia,ID,🇮🇩,0,low,No,PT Indo Telemedia Solusi
103.187.215.124:8050,HTTP,Indonesia,ID,🇮🇩,0,low,No,PT Inti Data Telematika
103.247.23.76:8081,HTTP,Indonesia,ID,🇮🇩,0,low,No,PT wifian Solution
38.183.146.163:8080,HTTP,Indonesia,ID,🇮🇩,0,low,No,PT Ikhlas Cipta Teknologi
36.64.181.82:8080,HTTP,Indonesia,ID,🇮🇩,0,low,No,PT. Telekomunikasi Indonesia
163.227.250.58:8080,HTTP,Indonesia,ID,🇮🇩,0,low,No,PT Media Central Access
157.20.239.165:8080,HTTP,Indonesia,ID,🇮🇩,0,low,No,PT Era Network Indonesia
154.19.39.151:8090,HTTP,Indonesia,ID,🇮🇩,0,low,No,PT Lintas Network Solusi
103.39.51.156:1080,HTTP,Indonesia,ID,🇮🇩,0,low,No,PT. Mega Mentari Mandiri
103.227.187.3:6090,HTTP,Indonesia,ID,🇮🇩,0,low,No,PT Master Star Network
103.188.173.37:2211,HTTP,Indonesia,ID,🇮🇩,0,low,No,PT Satria Digital Media
157.15.40.251:7777,HTTP,Indonesia,ID,🇮🇩,0,low,No,TRISARI
103.255.132.210:1111,HTTP,Indonesia,ID,🇮🇩,0,low,No,Sarana Kawan Setia
157.20.207.74:3127,HTTP,Indonesia,ID,🇮🇩,0,low,No,PT Erajaya Telco Indonesia
182.253.181.10:8080,HTTP,Indonesia,ID,🇮🇩,0,low,No,BIZNET
103.255.243.10:8080,HTTP,Indonesia,ID,🇮🇩,0,low,No,PT Media Sarana Data
103.84.228.12:3128,HTTP,Indonesia,ID,🇮🇩,0,low,No,STARNET
103.156.248.39:8080,HTTP,Indonesia,ID,🇮🇩,0,low,No,Trans Media Telekomunikasi
103.15.214.225:8080,HTTP,Indonesia,ID,🇮🇩,0,low,No,PT. Java Digital Nusantara
103.165.157.206:8088,HTTP,Indonesia,ID,🇮🇩,0,low,No,MEGADATA-ISP
210.87.92.212:8080,HTTP,Indonesia,ID,🇮🇩,0,low,No,PT Indo Telemedia Solusi
27.50.29.226:8080,HTTP,Indonesia,ID,🇮🇩,0,low,No,PT. Mora Telematika Indonesia
103.191.251.197:8080,HTTP,Indonesia,ID,🇮🇩,0,low,No,PT Mulia Batam Net
210.87.74.181:8080,HTTP,Indonesia,ID,🇮🇩,0,low,No,PT.Global Media Data Prima
49.0.26.151:8080,HTTP,Indonesia,ID,🇮🇩,0,low,No,SIMS Jabar Banten Medianet
103.172.18.38:3125,HTTP,Indonesia,ID,🇮🇩,0,low,No,PT Klinik Digital Indonesia JNHOST
160.19.19.9:8080,HTTP,Indonesia,ID,🇮🇩,0,low,No,PT Indo Telemedia Solusi
103.193.144.15:8080,HTTP,Indonesia,ID,🇮🇩,0,low,No,PT Lintas Jaringan Nusantara
161.248.206.196:8080,HTTP,Indonesia,ID,🇮🇩,0,low,No,PT Iktiar Doa Tawakal
103.234.19.238:8080,HTTP,Indonesia,ID,🇮🇩,0,low,No,PT Widjaja Piranti Teknologi
103.195.142.250:8180,HTTP,Indonesia,ID,🇮🇩,0,low,No,Universitas Hasanuddin
36.88.148.139:8080,HTTP,Indonesia,ID,🇮🇩,1,low,No,PT. Telekomunikasi Indonesia
36.88.150.66:8080,HTTP,Indonesia,ID,🇮🇩,1,low,No,PT. Telekomunikasi Indonesia
36.92.60.234:8080,HTTP,Indonesia,ID,🇮🇩,1,low,No,PT. Telekomunikasi Indonesia
36.88.141.105:8080,HTTP,Indonesia,ID,🇮🇩,1,low,No,PT. Telekomunikasi Indonesia
8.215.15.163:8080,HTTP,Indonesia,ID,🇮🇩,5,low,No,"Alibaba (US) Technology Co., Ltd."
8.215.15.163:50,HTTP,Indonesia,ID,🇮🇩,5,low,No,"Alibaba (US) Technology Co., Ltd."
103.121.22.192:8080,HTTP,Indonesia,ID,🇮🇩,6,low,No,PT. Eka Mas Republik
149.129.226.9:37,HTTP,Indonesia,ID,🇮🇩,9,low,No,Alibaba.com Singapore E-Commerce Private Limited
103.178.88.102:8080,HTTP,Indonesia,ID,🇮🇩,100,very_high,No,PT INTER MEDIALINK SOLUSI
