Proxy,Protocol,Country,Country Code,Flag,Fraud Score,Risk,VPN,ISP
8.215.3.250:7777,HTTP,Indonesia,ID,🇮🇩,0,low,No,Alibaba Cloud (Singapore) Private Limited
103.227.186.217:6080,HTTP,Indonesia,ID,🇮🇩,0,low,No,PT Master Star Network
103.75.84.201:8080,HTTP,Indonesia,ID,🇮🇩,0,low,No,MEGADATA
103.156.248.60:8080,HTTP,Indonesia,ID,🇮🇩,0,low,No,Trans Media Telekomunikasi
202.58.77.235:8080,HTTP,Indonesia,ID,🇮🇩,0,low,No,PT Data Buana Nusantara
103.71.162.17:8080,HTTP,Indonesia,ID,🇮🇩,0,low,No,PT. Menaksopal Link Nusantara
203.175.126.229:8000,HTTP,Indonesia,ID,🇮🇩,0,low,No,PT Cubiespot Pilar Data Nusantara
203.175.103.124:8080,HTTP,Indonesia,ID,🇮🇩,0,low,No,PT. Mitra Kita Brilian
8.215.3.250:6379,HTTP,Indonesia,ID,🇮🇩,0,low,No,Alibaba Cloud (Singapore) Private Limited
38.46.233.146:8080,HTTP,Indonesia,ID,🇮🇩,0,low,No,PT CYB Media Group
103.124.138.149:8080,HTTP,Indonesia,ID,🇮🇩,0,low,No,Global Media Data Prima
103.156.17.137:8818,HTTP,Indonesia,ID,🇮🇩,0,low,No,RSTNET
157.20.253.164:8080,HTTP,Indonesia,ID,🇮🇩,0,low,No,PT.Global Media Data Prima
103.46.8.85:8080,HTTP,Indonesia,ID,🇮🇩,0,low,No,PT JARINGANKU SARANA NUSANTARA
113.192.3.107:8567,HTTP,Indonesia,ID,🇮🇩,0,low,No,PT Boombas Carlo Medianet
43.252.106.66:8080,HTTP,Indonesia,ID,🇮🇩,0,low,No,PT Lintas Data Prima
103.107.84.178:8080,HTTP,Indonesia,ID,🇮🇩,0,low,No,PT. Media Jaringan Indonesia
103.67.84.74:8080,HTTP,Indonesia,ID,🇮🇩,0,low,No,PT Tujuh Fondasi Teknologi
175.158.40.224:1616,HTTP,Indonesia,ID,🇮🇩,0,low,No,Indonesia Network Information Center
103.46.8.61:8080,HTTP,Indonesia,ID,🇮🇩,0,low,No,PT JARINGANKU SARANA NUSANTARA
103.166.33.56:8080,HTTP,Indonesia,ID,🇮🇩,0,low,No,PT Daniswara Citra Informatika
103.227.187.1:6080,HTTP,Indonesia,ID,🇮🇩,0,low,No,PT Master Star Network
103.175.240.65:7777,HTTP,Indonesia,ID,🇮🇩,0,low,No,LDP
103.204.46.2:8090,HTTP,Indonesia,ID,🇮🇩,0,low,No,PT Wifa Lintas Data
103.177.8.119:10133,HTTP,Indonesia,ID,🇮🇩,0,low,No,PT Helium Sinergi Telekomunikasi
160.19.18.127:8181,HTTP,Indonesia,ID,🇮🇩,0,low,No,PT Indo Telemedia Solusi
103.247.23.201:8080,HTTP,Indonesia,ID,🇮🇩,0,low,No,PT wifian Solution
103.15.214.225:8080,HTTP,Indonesia,ID,🇮🇩,0,low,No,PT. Java Digital Nusantara
101.255.106.33:1452,HTTP,Indonesia,ID,🇮🇩,0,low,No,PT Remala Abadi
103.142.255.32:8080,HTTP,Indonesia,ID,🇮🇩,0,low,No,PT.CITRA BERDIKARI NUSANTARA
103.171.255.204:8080,HTTP,Indonesia,ID,🇮🇩,0,low,No,PT Zona Kolektif Indonesia
157.20.244.117:8821,HTTP,Indonesia,ID,🇮🇩,0,low,No,PT.Global Media Data Prima
157.20.207.115:8080,HTTP,Indonesia,ID,🇮🇩,0,low,No,PT Erajaya Telco Indonesia
103.106.79.98:8080,HTTP,Indonesia,ID,🇮🇩,0,low,No,PT Quantum Tera Multimedia
103.153.191.119:3128,HTTP,Indonesia,ID,🇮🇩,0,low,No,WANET
103.76.109.167:443,HTTP,Indonesia,ID,🇮🇩,0,low,No,PT Mahawira Nusantara Grup
103.183.8.185:8080,HTTP,Indonesia,ID,🇮🇩,0,low,No,PT Cepat Multi Data
103.178.21.104:3125,HTTP,Indonesia,ID,🇮🇩,0,low,No,PT Trisna Mega Abadi
103.82.246.17:6080,HTTP,Indonesia,ID,🇮🇩,0,low,No,PT Master Star Network
103.235.181.245:8080,HTTP,Indonesia,ID,🇮🇩,0,low,No,PT Top Class Universal
103.172.197.186:8080,HTTP,Indonesia,ID,🇮🇩,0,low,No,PT Cahaya Solusindo Internusa
103.214.251.66:8080,HTTP,Indonesia,ID,🇮🇩,0,low,No,PT Bittara Interkoneksi Nusantara
160.19.19.102:8080,HTTP,Indonesia,ID,🇮🇩,0,low,No,PT Indo Telemedia Solusi
103.36.8.7:3125,HTTP,Indonesia,ID,🇮🇩,0,low,No,PT Awinet Global Mandiri
103.189.249.196:1111,HTTP,Indonesia,ID,🇮🇩,0,low,No,PT Berkah Media Kusuma Vision
103.178.2.72:8818,HTTP,Indonesia,ID,🇮🇩,0,low,No,RSTNET
103.189.250.89:8090,HTTP,Indonesia,ID,🇮🇩,0,low,No,PT Pandawa Lima Java Network
103.166.33.88:8080,HTTP,Indonesia,ID,🇮🇩,0,low,No,PT Daniswara Citra Informatika
157.20.128.141:8080,HTTP,Indonesia,ID,🇮🇩,0,low,No,PT Citra Meta Data
192.232.48.2:8181,HTTP,Indonesia,ID,🇮🇩,0,low,No,PT Axindo Infinitas Network
36.68.150.7:3128,HTTP,Indonesia,ID,🇮🇩,0,low,No,PT. TELKOM INDONESIA
103.194.175.51:7777,HTTP,Indonesia,ID,🇮🇩,0,low,No,MYNET
103.247.13.131:8085,HTTP,Indonesia,ID,🇮🇩,0,low,No,TERABIT
103.238.232.114:8080,HTTP,Indonesia,ID,🇮🇩,0,low,No,PT Digital Netcom Solution
103.160.205.51:8080,HTTP,Indonesia,ID,🇮🇩,0,low,No,PRIME
103.151.20.131:80,HTTP,Indonesia,ID,🇮🇩,0,low,No,Dinas Komunikasi dan Informatika Kota Makassar
160.19.18.99:8080,HTTP,Indonesia,ID,🇮🇩,0,low,No,PT Indo Telemedia Solusi
115.85.88.18:8080,HTTP,Indonesia,ID,🇮🇩,0,low,No,Sudirman Central Business District
121.101.129.72:3128,HTTP,Indonesia,ID,🇮🇩,0,low,No,PT SELARAS CITRA TERABIT
156.230.187.234:8081,HTTP,Indonesia,ID,🇮🇩,0,low,No,My Republic Indonesia
121.101.129.97:8181,HTTP,Indonesia,ID,🇮🇩,0,low,No,PT SELARAS CITRA TERABIT
103.234.31.79:8080,HTTP,Indonesia,ID,🇮🇩,0,low,No,PT Jenius Lintas Nusantara
103.165.128.171:8080,HTTP,Indonesia,ID,🇮🇩,0,low,No,PT iForte Global Internet
113.192.12.4:3333,HTTP,Indonesia,ID,🇮🇩,0,low,No,PT Parsaoran Global Datatrans
103.39.72.221:8990,HTTP,Indonesia,ID,🇮🇩,0,low,No,PT Teknologi Gema Informasi
103.22.99.95:1111,HTTP,Indonesia,ID,🇮🇩,0,low,No,KHALISTAGROUP
103.189.249.140:1111,HTTP,Indonesia,ID,🇮🇩,0,low,No,PT Berkah Media Kusuma Vision
163.227.248.71:8181,HTTP,Indonesia,ID,🇮🇩,0,low,No,PT Rajasa Sinergi Komunikasi
103.178.2.16:8818,HTTP,Indonesia,ID,🇮🇩,0,low,No,RSTNET
103.185.43.146:3125,HTTP,Indonesia,ID,🇮🇩,0,low,No,PT Awinet Global Mandiri
113.192.12.107:8080,HTTP,Indonesia,ID,🇮🇩,0,low,No,PT Parsaoran Global Datatrans
192.188.80.218:80,HTTP,Indonesia,ID,🇮🇩,0,low,No,PT Rayunet Broadcast Solution
103.97.140.226:8080,HTTP,Indonesia,ID,🇮🇩,0,low,No,PT Jembatan Data Pangrango
101.255.32.42:8080,HTTP,Indonesia,ID,🇮🇩,0,low,No,PT Remala Abadi
36.93.163.219:8080,HTTP,Indonesia,ID,🇮🇩,0,low,No,Telekomunikasi Indonesia
192.188.80.38:3128,HTTP,Indonesia,ID,🇮🇩,0,low,No,PT Rayunet Broadcast Solution
103.188.33.74:8085,HTTP,Indonesia,ID,🇮🇩,0,low,No,LINTASARTA
103.159.195.193:3125,HTTP,Indonesia,ID,🇮🇩,0,low,No,PT Giga Digital Nusantara
36.64.86.11:8080,HTTP,Indonesia,ID,🇮🇩,0,low,No,PT. Telekomunikasi Indonesia
103.139.126.85:8080,HTTP,Indonesia,ID,🇮🇩,0,low,No,PT. MITRACOM SOLUSI TEKNOLOGI
36.92.61.75:8080,HTTP,Indonesia,ID,🇮🇩,0,low,No,Telekomunikasi Indonesia
103.214.251.106:8080,HTTP,Indonesia,ID,🇮🇩,0,low,No,PT Bittara Interkoneksi Nusantara
103.176.98.225:3088,HTTP,Indonesia,ID,🇮🇩,0,low,No,Dhoho ISP
103.155.116.238:3030,HTTP,Indonesia,ID,🇮🇩,0,low,No,IOSYS
103.14.2.138:2020,HTTP,Indonesia,ID,🇮🇩,0,low,No,MADA
103.227.24.230:1080,HTTP,Indonesia,ID,🇮🇩,0,low,No,PT Sumber Data Indonesia
114.8.131.181:8080,HTTP,Indonesia,ID,🇮🇩,0,low,No,PT. INDOSAT Tbk
103.171.255.242:8086,HTTP,Indonesia,ID,🇮🇩,0,low,No,PT Zona Kolektif Indonesia
103.177.104.121:8080,HTTP,Indonesia,ID,🇮🇩,0,low,No,PT. Fiber Networks Indonesia
103.156.75.243:3125,HTTP,Indonesia,ID,🇮🇩,0,low,No,PT Trika Global Media
103.152.238.21:3125,HTTP,Indonesia,ID,🇮🇩,0,low,No,APRIN
45.198.8.10:8080,HTTP,Indonesia,ID,🇮🇩,0,low,No,PT Citra Celebas Multimedia
103.154.77.46:1111,HTTP,Indonesia,ID,🇮🇩,0,low,No,T2NET
103.153.191.151:8080,HTTP,Indonesia,ID,🇮🇩,0,low,No,WANET
103.114.52.130:8080,HTTP,Indonesia,ID,🇮🇩,0,low,No,Proxy-registered
103.94.10.254:8080,HTTP,Indonesia,ID,🇮🇩,0,low,No,PT Widya Intersat Nusantara
103.65.237.92:5678,HTTP,Indonesia,ID,🇮🇩,0,low,No,PT Berkah Solusi Teknologi Informasi
180.148.25.46:8181,HTTP,Indonesia,ID,🇮🇩,0,low,No,PT GIGA NETWORK INDONESIA
36.64.162.194:8080,HTTP,Indonesia,ID,🇮🇩,0,low,No,PT. Telekomunikasi Indonesia
180.211.93.108:8080,HTTP,Indonesia,ID,🇮🇩,0,low,No,KINGS
103.154.77.82:1111,HTTP,Indonesia,ID,🇮🇩,0,low,No,T2NET
114.9.55.102:1111,HTTP,Indonesia,ID,🇮🇩,0,low,No,PT. INDOSAT Tbk
103.185.43.242:8080,HTTP,Indonesia,ID,🇮🇩,0,low,No,PT Awinet Global Mandiri
103.156.15.46:8080,HTTP,Indonesia,ID,🇮🇩,0,low,No,PT Lintas Jaringan Nusantara
103.174.123.4:8090,HTTP,Indonesia,ID,🇮🇩,0,low,No,PT Jaya Sejahtra Nugraha
157.66.174.228:8080,HTTP,Indonesia,ID,🇮🇩,0,low,No,PT Win Artha Mandiri
103.163.80.56:8080,HTTP,Indonesia,ID,🇮🇩,0,low,No,PT Data Arta Sedaya
103.247.23.202:8080,HTTP,Indonesia,ID,🇮🇩,0,low,No,PT wifian Solution
182.253.228.155:8080,HTTP,Indonesia,ID,🇮🇩,0,low,No,BIZNET
103.145.34.109:1111,HTTP,Indonesia,ID,🇮🇩,0,low,No,PT Lintas Data Multimedia
103.36.8.9:3125,HTTP,Indonesia,ID,🇮🇩,0,low,No,PT Awinet Global Mandiri
103.154.52.5:1111,HTTP,Indonesia,ID,🇮🇩,0,low,No,WIFIKITA
103.172.71.135:3127,HTTP,Indonesia,ID,🇮🇩,0,low,No,AZNET
103.189.254.72:8080,HTTP,Indonesia,ID,🇮🇩,0,low,No,PT Lintas Daya Nusantara
103.166.159.93:8080,HTTP,Indonesia,ID,🇮🇩,0,low,No,PT Timor Lintas Nusantara
103.153.62.242:8181,HTTP,Indonesia,ID,🇮🇩,0,low,No,PT Ikhlas Cipta Teknologi
103.106.79.253:2233,HTTP,Indonesia,ID,🇮🇩,0,low,No,PT Quantum Tera Multimedia
103.227.187.23:8080,HTTP,Indonesia,ID,🇮🇩,0,low,No,PT Master Star Network
103.163.103.208:8080,HTTP,Indonesia,ID,🇮🇩,0,low,No,PT Mamura Inter Media
103.82.246.25:6080,HTTP,Indonesia,ID,🇮🇩,0,low,No,PT Master Star Network
103.101.216.70:8080,HTTP,Indonesia,ID,🇮🇩,0,low,No,PT Duta Trans Nusantara Network
103.154.152.62:8085,HTTP,Indonesia,ID,🇮🇩,0,low,No,MORATELINDONAP
36.95.208.10:8080,HTTP,Indonesia,ID,🇮🇩,1,low,No,PT. Telekomunikasi Indonesia
36.95.245.7:8090,HTTP,Indonesia,ID,🇮🇩,1,low,No,PT. Telekomunikasi Indonesia
36.91.148.36:8080,HTTP,Indonesia,ID,🇮🇩,1,low,No,PT. Telekomunikasi Indonesia
8.215.15.163:8118,HTTP,Indonesia,ID,🇮🇩,2,low,No,"Alibaba (US) Technology Co., Ltd."
8.215.25.3:2080,HTTP,Indonesia,ID,🇮🇩,2,low,Yes,"Alibaba (US) Technology Co., Ltd."
149.129.226.9:20,HTTP,Indonesia,ID,🇮🇩,9,low,No,Alibaba.com Singapore E-Commerce Private Limited
149.129.226.9:3128,HTTP,Indonesia,ID,🇮🇩,9,low,No,Alibaba.com Singapore E-Commerce Private Limited
202.162.195.157:8080,HTTP,Indonesia,ID,🇮🇩,55,medium,No,PT. Media Antar Nusa
