Proxy,Protocol,Country,Country Code,Flag,Fraud Score,Risk,VPN,ISP
36.95.142.35:8080,HTTP,Indonesia,ID,🇮🇩,0,low,No,Telekomunikasi Indonesia
103.154.152.104:8090,HTTP,Indonesia,ID,🇮🇩,0,low,No,MORATELINDONAP
103.208.102.1:8080,HTTP,Indonesia,ID,🇮🇩,0,low,No,PT Tidar Lintas Nusa
103.133.61.165:3168,HTTP,Indonesia,ID,🇮🇩,0,low,No,TLINK
103.193.144.15:8080,HTTP,Indonesia,ID,🇮🇩,0,low,No,PT Lintas Jaringan Nusantara
182.253.38.179:3128,HTTP,Indonesia,ID,🇮🇩,0,low,No,BIZNET
203.190.44.107:2022,HTTP,Indonesia,ID,🇮🇩,0,low,No,PT Jaring Lintas Utara
103.110.10.174:3300,HTTP,Indonesia,ID,🇮🇩,0,low,No,PT Citra Jelajah Informatika
203.2.151.21:8080,HTTP,Indonesia,ID,🇮🇩,0,low,No,PT BARAYA BARENG SADULUR
103.154.222.58:1111,HTTP,Indonesia,ID,🇮🇩,0,low,No,MORATELINDONAP
103.173.138.236:1111,HTTP,Indonesia,ID,🇮🇩,0,low,No,PT Serayu Multi Connection
103.234.35.141:8080,HTTP,Indonesia,ID,🇮🇩,0,low,No,PT. EXABIT GROUP NETWORK
103.102.12.22:8000,HTTP,Indonesia,ID,🇮🇩,0,low,No,FISNET
210.79.146.82:8085,HTTP,Indonesia,ID,🇮🇩,0,low,No,PT Petabyte Network Indonesia
157.15.67.49:8080,HTTP,Indonesia,ID,🇮🇩,0,low,No,PT Trimitra Aditama Koneksindo
103.204.46.2:8090,HTTP,Indonesia,ID,🇮🇩,0,low,No,PT Wifa Lintas Data
103.191.171.51:1234,HTTP,Indonesia,ID,🇮🇩,0,low,No,PT Sahabat Manjur Grup
103.133.27.11:8080,HTTP,Indonesia,ID,🇮🇩,0,low,No,PT PHATRIA INTI PERSADA
103.188.174.7:8080,HTTP,Indonesia,ID,🇮🇩,0,low,No,PT. Fiber Networks Indonesia
154.19.39.220:8090,HTTP,Indonesia,ID,🇮🇩,0,low,No,PT Lintas Network Solusi
192.42.85.26:8080,HTTP,Indonesia,ID,🇮🇩,0,low,No,PT Ryndo Jaringan Nusantara
103.193.144.81:8080,HTTP,Indonesia,ID,🇮🇩,0,low,No,PT Lintas Jaringan Nusantara
103.171.183.245:8080,HTTP,Indonesia,ID,🇮🇩,0,low,No,PT Hayat Teknologi Informatika
103.14.2.138:2020,HTTP,Indonesia,ID,🇮🇩,0,low,No,MADA
38.226.240.234:8080,HTTP,Indonesia,ID,🇮🇩,0,low,No,PT Putra Garsel Interkoneksi
103.184.54.7:8080,HTTP,Indonesia,ID,🇮🇩,0,low,No,PT Proxi Jaringan Nusantara
43.252.106.66:8080,HTTP,Indonesia,ID,🇮🇩,0,low,No,PT Lintas Data Prima
163.227.248.71:8181,HTTP,Indonesia,ID,🇮🇩,0,low,No,PT Rajasa Sinergi Komunikasi
103.36.8.9:3125,HTTP,Indonesia,ID,🇮🇩,0,low,No,PT Awinet Global Mandiri
163.227.146.17:8181,HTTP,Indonesia,ID,🇮🇩,0,low,No,PT EXA TELEKOMUNIKASI NUSANTARA
103.159.195.183:1080,HTTP,Indonesia,ID,🇮🇩,0,low,No,PT Giga Digital Nusantara
38.183.146.122:8080,HTTP,Indonesia,ID,🇮🇩,0,low,No,PT Ikhlas Cipta Teknologi
103.177.104.121:8080,HTTP,Indonesia,ID,🇮🇩,0,low,No,PT. Fiber Networks Indonesia
103.189.249.196:1111,HTTP,Indonesia,ID,🇮🇩,0,low,No,PT Berkah Media Kusuma Vision
103.166.0.30:1111,HTTP,Indonesia,ID,🇮🇩,0,low,No,PT Balian Media Online Nusantara
103.82.246.21:6080,HTTP,Indonesia,ID,🇮🇩,0,low,No,PT Master Star Network
103.133.25.247:8080,HTTP,Indonesia,ID,🇮🇩,0,low,No,PT PHATRIA INTI PERSADA
180.211.93.91:8080,HTTP,Indonesia,ID,🇮🇩,0,low,No,KINGS
160.25.223.14:8181,HTTP,Indonesia,ID,🇮🇩,0,low,No,PT Telemedia Prima Nusantara
103.156.75.213:8091,HTTP,Indonesia,ID,🇮🇩,0,low,No,PT Trika Global Media
157.20.207.29:8080,HTTP,Indonesia,ID,🇮🇩,0,low,No,PT Erajaya Telco Indonesia
8.215.3.250:8008,HTTP,Indonesia,ID,🇮🇩,0,low,No,Alibaba Cloud (Singapore) Private Limited
38.46.233.146:8080,HTTP,Indonesia,ID,🇮🇩,0,low,No,PT CYB Media Group
202.169.250.148:8111,HTTP,Indonesia,ID,🇮🇩,0,low,No,PT. Rabik Bangun Pertiwi
121.101.129.103:8080,HTTP,Indonesia,ID,🇮🇩,0,low,No,PT SELARAS CITRA TERABIT
103.153.191.119:3128,HTTP,Indonesia,ID,🇮🇩,0,low,No,WANET
157.15.40.250:7777,HTTP,Indonesia,ID,🇮🇩,0,low,No,TRISARI
121.101.133.220:7777,HTTP,Indonesia,ID,🇮🇩,0,low,No,PT SELARAS CITRA TERABIT
175.158.44.21:3125,HTTP,Indonesia,ID,🇮🇩,0,low,No,CBNNAP
103.178.2.72:8818,HTTP,Indonesia,ID,🇮🇩,0,low,No,RSTNET
103.154.231.123:8090,HTTP,Indonesia,ID,🇮🇩,0,low,No,DIGITNET
45.198.20.173:8080,HTTP,Indonesia,ID,🇮🇩,0,low,No,PT IKHLAS CIPTA TEKNOLOGI
113.192.31.206:8080,HTTP,Indonesia,ID,🇮🇩,0,low,No,PT Indo Telemedia Solusi
36.92.106.41:8080,HTTP,Indonesia,ID,🇮🇩,0,low,No,Telekomunikasi Indonesia
210.87.125.57:8080,HTTP,Indonesia,ID,🇮🇩,0,low,No,CV Brawijaya Giga Network
202.58.77.195:8080,HTTP,Indonesia,ID,🇮🇩,0,low,No,PT Data Buana Nusantara
103.80.88.77:8080,HTTP,Indonesia,ID,🇮🇩,0,low,No,PT Jala Lintas Media
157.66.16.38:8070,HTTP,Indonesia,ID,🇮🇩,0,low,No,PT Mitra Mandiri Network
210.87.92.137:1111,HTTP,Indonesia,ID,🇮🇩,0,low,No,PT Indo Telemedia Solusi
103.174.122.92:8080,HTTP,Indonesia,ID,🇮🇩,0,low,No,PT Jaya Sejahtra Nugraha
103.93.93.170:8181,HTTP,Indonesia,ID,🇮🇩,0,low,No,MYRISE
103.80.214.43:8080,HTTP,Indonesia,ID,🇮🇩,0,low,No,PT Redi Revolusi Digital Solusi
175.158.63.166:1111,HTTP,Indonesia,ID,🇮🇩,0,low,No,CBNNAP
36.64.86.11:8080,HTTP,Indonesia,ID,🇮🇩,0,low,No,PT. Telekomunikasi Indonesia
103.139.127.244:8080,HTTP,Indonesia,ID,🇮🇩,0,low,No,PT. MITRACOM SOLUSI TEKNOLOGI
165.101.43.67:8080,HTTP,Indonesia,ID,🇮🇩,0,low,No,PT Lintas Jaringan Nusantara
103.189.249.219:8080,HTTP,Indonesia,ID,🇮🇩,0,low,No,PT Berkah Media Kusuma Vision
157.20.252.170:8080,HTTP,Indonesia,ID,🇮🇩,0,low,No,PT.Global Media Data Prima
103.191.251.197:8080,HTTP,Indonesia,ID,🇮🇩,0,low,No,PT Mulia Batam Net
103.101.216.70:8080,HTTP,Indonesia,ID,🇮🇩,0,low,No,PT Duta Trans Nusantara Network
36.50.56.210:8818,HTTP,Indonesia,ID,🇮🇩,0,low,No,PT Andromega Data Nusantara
103.166.33.88:8080,HTTP,Indonesia,ID,🇮🇩,0,low,No,PT Daniswara Citra Informatika
103.220.23.113:8080,HTTP,Indonesia,ID,🇮🇩,0,low,No,CV. LINTAS MEDIA
45.198.10.47:1111,HTTP,Indonesia,ID,🇮🇩,0,low,No,PT Jaringan Lintas Artha
192.188.80.214:8082,HTTP,Indonesia,ID,🇮🇩,0,low,No,PT Rayunet Broadcast Solution
103.157.78.85:8080,HTTP,Indonesia,ID,🇮🇩,0,low,No,PT Super Media Indonesia
103.174.122.79:8080,HTTP,Indonesia,ID,🇮🇩,0,low,No,PT Jaya Sejahtra Nugraha
157.20.207.74:3127,HTTP,Indonesia,ID,🇮🇩,0,low,No,PT Erajaya Telco Indonesia
101.255.209.93:8090,HTTP,Indonesia,ID,🇮🇩,0,low,No,PT Remala Abadi
103.203.234.147:8080,HTTP,Indonesia,ID,🇮🇩,0,low,No,PT Nesta Indo Media
103.97.140.121:3125,HTTP,Indonesia,ID,🇮🇩,0,low,No,PT Jembatan Data Pangrango
103.171.255.108:8080,HTTP,Indonesia,ID,🇮🇩,0,low,No,PT Zona Kolektif Indonesia
110.76.147.27:1080,HTTP,Indonesia,ID,🇮🇩,0,low,No,PT Pika Media Komunika
103.189.116.20:8080,HTTP,Indonesia,ID,🇮🇩,0,low,No,PT Callysta Total Solusindo
103.172.71.135:3127,HTTP,Indonesia,ID,🇮🇩,0,low,No,AZNET
210.87.92.135:8080,HTTP,Indonesia,ID,🇮🇩,0,low,No,PT Indo Telemedia Solusi
202.56.166.174:8080,HTTP,Indonesia,ID,🇮🇩,0,low,No,PT Lintas Data Prima
103.247.22.57:2022,HTTP,Indonesia,ID,🇮🇩,0,low,No,PT wifian Solution
103.142.255.121:8081,HTTP,Indonesia,ID,🇮🇩,0,low,No,PT.CITRA BERDIKARI NUSANTARA
165.101.231.92:8090,HTTP,Indonesia,ID,🇮🇩,0,low,No,PT Anugerah Cimanuk Raya
103.165.123.109:8080,HTTP,Indonesia,ID,🇮🇩,0,low,No,PT iForte Global Internet
103.171.161.96:9090,HTTP,Indonesia,ID,🇮🇩,0,low,No,MYREPUBLIC
103.55.22.236:8080,HTTP,Indonesia,ID,🇮🇩,0,low,No,PT General Media Network
103.192.174.154:8080,HTTP,Indonesia,ID,🇮🇩,0,low,No,PT JKB Telematika Indonesia
203.175.102.223:3128,HTTP,Indonesia,ID,🇮🇩,0,low,No,PT. Mitra Kita Brilian
103.173.72.25:1111,HTTP,Indonesia,ID,🇮🇩,0,low,No,PT Eyza Kausa Sinergi Abadi
103.160.205.12:8081,HTTP,Indonesia,ID,🇮🇩,0,low,No,PRIME
202.58.77.133:8080,HTTP,Indonesia,ID,🇮🇩,0,low,No,PT Data Buana Nusantara
103.253.127.45:8090,HTTP,Indonesia,ID,🇮🇩,0,low,No,PT Media Akses Telematika
116.12.47.218:9595,HTTP,Indonesia,ID,🇮🇩,0,low,No,ADSNET
192.188.80.218:80,HTTP,Indonesia,ID,🇮🇩,0,low,No,PT Rayunet Broadcast Solution
103.180.123.229:1080,HTTP,Indonesia,ID,🇮🇩,0,low,No,PT Indo Telemedia Solusi
157.15.0.152:7778,HTTP,Indonesia,ID,🇮🇩,0,low,No,Gopalnet
103.17.246.60:1080,HTTP,Indonesia,ID,🇮🇩,0,low,No,PT Blip Integrator Provider
103.247.23.202:8080,HTTP,Indonesia,ID,🇮🇩,0,low,No,PT wifian Solution
160.25.174.99:8080,HTTP,Indonesia,ID,🇮🇩,0,low,No,PT KANAL TELU MULTITEKNOLOGI
103.183.19.34:3128,HTTP,Indonesia,ID,🇮🇩,0,low,No,PT iForte Global Internet
103.177.8.119:8080,HTTP,Indonesia,ID,🇮🇩,0,low,No,PT Helium Sinergi Telekomunikasi
103.156.74.209:3125,HTTP,Indonesia,ID,🇮🇩,0,low,No,PT Trika Global Media
103.227.187.177:6090,HTTP,Indonesia,ID,🇮🇩,0,low,No,PT Master Star Network
103.156.75.215:9980,HTTP,Indonesia,ID,🇮🇩,0,low,No,PT Trika Global Media
103.39.72.221:8990,HTTP,Indonesia,ID,🇮🇩,0,low,No,PT Teknologi Gema Informasi
103.188.169.170:8080,HTTP,Indonesia,ID,🇮🇩,0,low,No,PT Lintas Jaringan Nusantara
183.91.88.226:3000,HTTP,Indonesia,ID,🇮🇩,0,low,No,PT Aplikanusa Lintasarta
103.172.42.93:1111,HTTP,Indonesia,ID,🇮🇩,0,low,No,PT Media Solusi Sukses
103.236.143.55:8080,HTTP,Indonesia,ID,🇮🇩,0,low,No,PT. Jaringan Internet Tayu
103.97.140.110:8080,HTTP,Indonesia,ID,🇮🇩,0,low,No,PT Jembatan Data Pangrango
103.163.80.56:8080,HTTP,Indonesia,ID,🇮🇩,0,low,No,PT Data Arta Sedaya
103.193.144.101:8080,HTTP,Indonesia,ID,🇮🇩,0,low,No,PT Lintas Jaringan Nusantara
160.22.92.24:8080,HTTP,Indonesia,ID,🇮🇩,0,low,No,PT Tiga Media Solusi
36.64.162.194:8080,HTTP,Indonesia,ID,🇮🇩,0,low,No,PT. Telekomunikasi Indonesia
103.188.168.69:8082,HTTP,Indonesia,ID,🇮🇩,0,low,No,PT Lintas Jaringan Nusantara
103.145.34.100:1111,HTTP,Indonesia,ID,🇮🇩,0,low,No,PT Lintas Data Multimedia
202.58.77.194:8031,HTTP,Indonesia,ID,🇮🇩,0,low,No,PT Data Buana Nusantara
38.211.24.242:8080,HTTP,Indonesia,ID,🇮🇩,0,low,No,PT Putra Garsel Interkoneksi
157.119.222.90:8080,HTTP,Indonesia,ID,🇮🇩,0,low,No,PT DES Teknologi Informasi
103.119.229.140:8080,HTTP,Indonesia,ID,🇮🇩,0,low,No,PT MITRA VISIONER PRATAMA
103.171.183.129:3125,HTTP,Indonesia,ID,🇮🇩,0,low,No,PT Hayat Teknologi Informatika
103.124.196.134:8080,HTTP,Indonesia,ID,🇮🇩,0,low,Yes,PT INFORMASI NUSANTARA TEKNOLOGI
103.118.102.98:80,HTTP,Indonesia,ID,🇮🇩,0,low,No,PT Cyberindo Aditama
103.183.13.94:8080,HTTP,Indonesia,ID,🇮🇩,0,low,No,PT iForte Global Internet
103.203.234.45:8080,HTTP,Indonesia,ID,🇮🇩,0,low,No,PT Nesta Indo Media
103.156.17.65:8818,HTTP,Indonesia,ID,🇮🇩,0,low,No,RSTNET
103.175.236.138:8082,HTTP,Indonesia,ID,🇮🇩,0,low,No,PT Marva Global Telekomunikasi
103.39.72.25:8990,HTTP,Indonesia,ID,🇮🇩,0,low,No,PT Teknologi Gema Informasi
103.191.218.171:8080,HTTP,Indonesia,ID,🇮🇩,0,low,No,PT Replay Inti Media
103.185.43.138:3125,HTTP,Indonesia,ID,🇮🇩,0,low,No,PT Awinet Global Mandiri
157.15.172.40:8090,HTTP,Indonesia,ID,🇮🇩,0,low,No,MITRATELEKOMUNIKASINUSANTARA
36.94.149.149:8090,HTTP,Indonesia,ID,🇮🇩,1,low,No,PT. Telekomunikasi Indonesia
36.95.208.10:8080,HTTP,Indonesia,ID,🇮🇩,1,low,No,PT. Telekomunikasi Indonesia
36.95.27.91:8080,HTTP,Indonesia,ID,🇮🇩,1,low,No,PT. Telekomunikasi Indonesia
8.215.25.3:2080,HTTP,Indonesia,ID,🇮🇩,2,low,Yes,"Alibaba (US) Technology Co., Ltd."
8.215.15.163:51,HTTP,Indonesia,ID,🇮🇩,2,low,No,"Alibaba (US) Technology Co., Ltd."
8.215.15.163:8008,HTTP,Indonesia,ID,🇮🇩,2,low,No,"Alibaba (US) Technology Co., Ltd."
149.129.255.179:18080,HTTP,Indonesia,ID,🇮🇩,9,low,No,Alibaba.com Singapore E-Commerce Private Limited
202.162.195.157:8080,HTTP,Indonesia,ID,🇮🇩,55,medium,No,PT. Media Antar Nusa
