Proxy,Protocol,Country,Country Code,Flag,Fraud Score,Risk,VPN,ISP
103.18.79.189:8082,HTTP,Indonesia,ID,🇮🇩,0,low,No,PT Usaha Adi Sanggoro
103.18.77.14:1111,HTTP,Indonesia,ID,🇮🇩,0,low,Yes,PT Usaha Adi Sanggoro
103.176.98.226:3088,HTTP,Indonesia,ID,🇮🇩,0,low,No,Dhoho ISP
113.192.31.17:8080,HTTP,Indonesia,ID,🇮🇩,0,low,No,PT Indo Telemedia Solusi
163.227.248.71:8181,HTTP,Indonesia,ID,🇮🇩,0,low,No,PT Rajasa Sinergi Komunikasi
103.191.218.171:8080,HTTP,Indonesia,ID,🇮🇩,0,low,No,PT Replay Inti Media
160.20.38.58:3125,HTTP,Indonesia,ID,🇮🇩,0,low,No,PT SAMUDRA DIGITAL NETWORK
103.208.102.1:8080,HTTP,Indonesia,ID,🇮🇩,0,low,No,PT Tidar Lintas Nusa
160.19.18.127:8181,HTTP,Indonesia,ID,🇮🇩,0,low,No,PT Indo Telemedia Solusi
103.126.87.112:1285,HTTP,Indonesia,ID,🇮🇩,0,low,No,PT. Rasi Bintang Perkasa
103.153.191.151:8080,HTTP,Indonesia,ID,🇮🇩,0,low,No,WANET
103.247.22.88:4317,HTTP,Indonesia,ID,🇮🇩,0,low,No,PT wifian Solution
114.8.131.181:8080,HTTP,Indonesia,ID,🇮🇩,0,low,No,PT. INDOSAT Tbk
36.93.163.219:8080,HTTP,Indonesia,ID,🇮🇩,0,low,No,Telekomunikasi Indonesia
202.58.77.214:8080,HTTP,Indonesia,ID,🇮🇩,0,low,No,PT Data Buana Nusantara
103.175.236.138:8082,HTTP,Indonesia,ID,🇮🇩,0,low,No,PT Marva Global Telekomunikasi
103.177.8.119:8080,HTTP,Indonesia,ID,🇮🇩,0,low,No,PT Helium Sinergi Telekomunikasi
103.165.237.195:3128,HTTP,Indonesia,ID,🇮🇩,0,low,No,PT iForte Global Internet
103.65.237.92:5678,HTTP,Indonesia,ID,🇮🇩,0,low,No,PT Berkah Solusi Teknologi Informasi
103.165.157.50:3125,HTTP,Indonesia,ID,🇮🇩,0,low,No,MEGADATA-ISP
103.156.75.243:3125,HTTP,Indonesia,ID,🇮🇩,0,low,No,PT Trika Global Media
103.163.103.69:6789,HTTP,Indonesia,ID,🇮🇩,0,low,No,PT Mamura Inter Media
103.189.249.196:1111,HTTP,Indonesia,ID,🇮🇩,0,low,No,PT Berkah Media Kusuma Vision
103.19.58.151:8080,HTTP,Indonesia,ID,🇮🇩,0,low,No,BITSNET
103.160.202.174:3125,HTTP,Indonesia,ID,🇮🇩,0,low,No,PT Sembilan Mediadata Nusaraya
202.58.77.9:8080,HTTP,Indonesia,ID,🇮🇩,0,low,No,PT Data Buana Nusantara
103.179.252.153:8181,HTTP,Indonesia,ID,🇮🇩,0,low,No,PT Pusaka Kreasi Mandiri
103.171.255.242:8086,HTTP,Indonesia,ID,🇮🇩,0,low,No,PT Zona Kolektif Indonesia
182.253.204.196:8080,HTTP,Indonesia,ID,🇮🇩,0,low,No,BIZNET
103.80.214.14:8181,HTTP,Indonesia,ID,🇮🇩,0,low,No,PT Redi Revolusi Digital Solusi
103.203.234.103:8080,HTTP,Indonesia,ID,🇮🇩,0,low,No,PT Nesta Indo Media
103.178.2.16:8818,HTTP,Indonesia,ID,🇮🇩,0,low,No,RSTNET
103.229.164.178:3128,HTTP,Indonesia,ID,🇮🇩,0,low,No,PT Indonesia Comnets Plus
103.71.162.41:8080,HTTP,Indonesia,ID,🇮🇩,0,low,No,PT. Menaksopal Link Nusantara
103.107.84.191:8080,HTTP,Indonesia,ID,🇮🇩,0,low,No,PT. Media Jaringan Indonesia
103.188.173.101:1080,HTTP,Indonesia,ID,🇮🇩,0,low,No,PT Satria Digital Media
103.156.14.15:8080,HTTP,Indonesia,ID,🇮🇩,0,low,No,PT Lintas Jaringan Nusantara
157.20.207.29:8080,HTTP,Indonesia,ID,🇮🇩,0,low,No,PT Erajaya Telco Indonesia
202.136.82.119:8080,HTTP,Indonesia,ID,🇮🇩,0,low,No,PT GIRI DATA SOLUSINDO
103.191.165.146:8181,HTTP,Indonesia,ID,🇮🇩,0,low,No,PT Sakti Wijaya Network
103.160.12.159:8080,HTTP,Indonesia,ID,🇮🇩,0,low,No,PT Mora Telematika Indonesia
160.19.84.23:61943,HTTP,Indonesia,ID,🇮🇩,0,low,No,CV CRON INTERDATA NUSANTARA
101.255.32.42:8080,HTTP,Indonesia,ID,🇮🇩,0,low,No,PT Remala Abadi
103.174.122.244:1111,HTTP,Indonesia,ID,🇮🇩,0,low,No,PT Jaya Sejahtra Nugraha
103.247.23.76:8081,HTTP,Indonesia,ID,🇮🇩,0,low,No,PT wifian Solution
202.154.19.153:8080,HTTP,Indonesia,ID,🇮🇩,0,low,No,DIGITNET
103.153.149.62:8038,HTTP,Indonesia,ID,🇮🇩,0,low,No,JARINGANKU
103.51.205.78:8080,HTTP,Indonesia,ID,🇮🇩,0,low,No,"Lintas Data Prima, PT"
45.198.20.192:3125,HTTP,Indonesia,ID,🇮🇩,0,low,No,PT IKHLAS CIPTA TEKNOLOGI
36.92.106.41:8080,HTTP,Indonesia,ID,🇮🇩,0,low,No,Telekomunikasi Indonesia
157.15.186.71:8080,HTTP,Indonesia,ID,🇮🇩,0,low,No,HAPPYINET
103.193.145.231:8080,HTTP,Indonesia,ID,🇮🇩,0,low,No,PT Lintas Jaringan Nusantara
203.2.151.21:8080,HTTP,Indonesia,ID,🇮🇩,0,low,No,PT BARAYA BARENG SADULUR
103.155.169.62:8299,HTTP,Indonesia,ID,🇮🇩,0,low,No,PT Arozak Bima Yudho Sangkara
103.183.8.139:8080,HTTP,Indonesia,ID,🇮🇩,0,low,No,PT Cepat Multi Data
103.166.0.30:1111,HTTP,Indonesia,ID,🇮🇩,0,low,No,PT Balian Media Online Nusantara
103.247.23.242:1111,HTTP,Indonesia,ID,🇮🇩,0,low,No,PT wifian Solution
210.87.92.135:8080,HTTP,Indonesia,ID,🇮🇩,0,low,No,PT Indo Telemedia Solusi
103.88.211.163:8080,HTTP,Indonesia,ID,🇮🇩,0,low,No,ICONPLN
114.129.19.139:8080,HTTP,Indonesia,ID,🇮🇩,0,low,No,PT Hipernet Indodata
103.25.167.30:8080,HTTP,Indonesia,ID,🇮🇩,0,low,No,PT Citra Jelajah Informatika
36.88.148.139:8080,HTTP,Indonesia,ID,🇮🇩,1,low,No,PT. Telekomunikasi Indonesia
36.95.245.7:8090,HTTP,Indonesia,ID,🇮🇩,1,low,No,PT. Telekomunikasi Indonesia
