Proxy,Protocol,Country,Country Code,Flag,Fraud Score,Risk,VPN,ISP
116.12.47.82:9595,HTTP,Indonesia,ID,🇮🇩,0,low,No,ADSNET
103.97.140.17:8080,HTTP,Indonesia,ID,🇮🇩,0,low,No,PT Jembatan Data Pangrango
139.255.5.98:443,HTTP,Indonesia,ID,🇮🇩,0,low,No,PT. LINKNET
103.132.52.189:8080,HTTP,Indonesia,ID,🇮🇩,0,low,No,PT Adeaksa Indo Jayatama
45.198.20.153:3125,HTTP,Indonesia,ID,🇮🇩,0,low,No,PT IKHLAS CIPTA TEKNOLOGI
103.155.196.160:8080,HTTP,Indonesia,ID,🇮🇩,0,low,No,JEMBATANDATA
103.172.121.61:7778,HTTP,Indonesia,ID,🇮🇩,0,low,No,PT Digital Akses Nusantara
103.180.123.27:8080,HTTP,Indonesia,ID,🇮🇩,0,low,No,PT Indo Telemedia Solusi
103.177.176.62:8080,HTTP,Indonesia,ID,🇮🇩,0,low,No,PT Milenial Inti Telekomunikasi
103.56.206.48:1604,HTTP,Indonesia,ID,🇮🇩,0,low,No,Argon Data Communication
45.198.32.235:8085,HTTP,Indonesia,ID,🇮🇩,0,low,No,PT Global Media Data Prima
103.233.152.18:8080,HTTP,Indonesia,ID,🇮🇩,0,low,No,BIZNET
36.93.214.253:8080,HTTP,Indonesia,ID,🇮🇩,0,low,No,Telekomunikasi Indonesia
103.244.107.246:8080,HTTP,Indonesia,ID,🇮🇩,0,low,No,PT Sahabat Fiber Indonesia
38.211.24.26:8091,HTTP,Indonesia,ID,🇮🇩,0,low,No,PT Putra Garsel Interkoneksi
113.192.31.79:8099,HTTP,Indonesia,ID,🇮🇩,0,low,No,PT Indo Telemedia Solusi
103.169.255.201:6080,HTTP,Indonesia,ID,🇮🇩,0,low,No,PT Master Star Network
103.82.246.17:6080,HTTP,Indonesia,ID,🇮🇩,0,low,No,PT Master Star Network
103.156.16.236:8818,HTTP,Indonesia,ID,🇮🇩,0,low,No,RSTNET
160.20.38.66:3125,HTTP,Indonesia,ID,🇮🇩,0,low,No,PT SAMUDRA DIGITAL NETWORK
103.242.104.150:8080,HTTP,Indonesia,ID,🇮🇩,0,low,No,PT Lintas Jaringan Nusantara
103.18.77.14:1111,HTTP,Indonesia,ID,🇮🇩,0,low,Yes,PT Usaha Adi Sanggoro
103.184.180.135:2021,HTTP,Indonesia,ID,🇮🇩,0,low,No,"Lintas Data Prima, PT"
203.175.126.229:8000,HTTP,Indonesia,ID,🇮🇩,0,low,No,PT Cubiespot Pilar Data Nusantara
202.58.77.9:8080,HTTP,Indonesia,ID,🇮🇩,0,low,No,PT Data Buana Nusantara
103.165.157.241:8090,HTTP,Indonesia,ID,🇮🇩,0,low,No,MEGADATA-ISP
103.171.183.245:8080,HTTP,Indonesia,ID,🇮🇩,0,low,No,PT Hayat Teknologi Informatika
202.47.185.162:8080,HTTP,Indonesia,ID,🇮🇩,0,low,No,PT Putra Garsel Interkoneksi
202.169.250.148:8111,HTTP,Indonesia,ID,🇮🇩,0,low,No,PT. Rabik Bangun Pertiwi
103.227.187.3:6090,HTTP,Indonesia,ID,🇮🇩,0,low,No,PT Master Star Network
103.156.17.83:8818,HTTP,Indonesia,ID,🇮🇩,0,low,No,RSTNET
103.147.118.240:8080,HTTP,Indonesia,ID,🇮🇩,0,low,No,PT.Bestcamp Prima Data
103.119.147.235:8080,HTTP,Indonesia,ID,🇮🇩,0,low,No,"PT Bali Towerindo Sentra, Tbk"
192.42.85.26:8080,HTTP,Indonesia,ID,🇮🇩,0,low,No,PT Ryndo Jaringan Nusantara
43.224.171.232:8080,HTTP,Indonesia,ID,🇮🇩,0,low,No,"Internet Madju Abad Millenindo, PT"
103.158.253.163:1111,HTTP,Indonesia,ID,🇮🇩,0,low,No,Rapid Network
101.255.151.205:8181,HTTP,Indonesia,ID,🇮🇩,0,low,No,PT Remala Abadi
103.82.246.19:6080,HTTP,Indonesia,ID,🇮🇩,0,low,No,PT Master Star Network
103.169.39.121:80,HTTP,Indonesia,ID,🇮🇩,0,low,No,PT Boombas Carlo Medianet
103.130.82.13:8282,HTTP,Indonesia,ID,🇮🇩,0,low,No,PT Central Digital Network
103.126.87.112:1285,HTTP,Indonesia,ID,🇮🇩,0,low,No,PT. Rasi Bintang Perkasa
103.133.25.119:8080,HTTP,Indonesia,ID,🇮🇩,0,low,No,PT PHATRIA INTI PERSADA
103.188.173.37:2211,HTTP,Indonesia,ID,🇮🇩,0,low,No,PT Satria Digital Media
103.193.145.155:8080,HTTP,Indonesia,ID,🇮🇩,0,low,No,PT Lintas Jaringan Nusantara
103.118.102.98:80,HTTP,Indonesia,ID,🇮🇩,0,low,No,PT Cyberindo Aditama
103.184.67.117:8181,HTTP,Indonesia,ID,🇮🇩,0,low,No,PT Siber Tech Indonesia
121.101.131.244:8080,HTTP,Indonesia,ID,🇮🇩,0,low,No,PT SELARAS CITRA TERABIT
38.253.240.213:3125,HTTP,Indonesia,ID,🇮🇩,0,low,No,Cogent Communications
160.25.119.101:8181,HTTP,Indonesia,ID,🇮🇩,0,low,No,PT High Speed Connection
163.223.78.137:8080,HTTP,Indonesia,ID,🇮🇩,0,low,No,PT Big Network Indonesia
157.66.36.170:8080,HTTP,Indonesia,ID,🇮🇩,0,low,No,PT Trik Media Data
103.175.240.65:7777,HTTP,Indonesia,ID,🇮🇩,0,low,No,LDP
103.122.1.12:8181,HTTP,Indonesia,ID,🇮🇩,0,low,No,PT. Java Digital Nusantara
103.175.202.190:8090,HTTP,Indonesia,ID,🇮🇩,0,low,No,PT Ameera Mega Buana
103.156.96.240:8088,HTTP,Indonesia,ID,🇮🇩,0,low,No,PT Karya Panca Telekomunikasi
38.183.146.53:8080,HTTP,Indonesia,ID,🇮🇩,0,low,No,PT Ikhlas Cipta Teknologi
103.145.129.43:8083,HTTP,Indonesia,ID,🇮🇩,0,low,No,PT. Indonesia Comnets Plus
210.87.74.236:1080,HTTP,Indonesia,ID,🇮🇩,0,low,No,PT.Global Media Data Prima
103.141.150.147:8080,HTTP,Indonesia,ID,🇮🇩,0,low,No,PRIMACOM
103.178.2.72:8818,HTTP,Indonesia,ID,🇮🇩,0,low,No,RSTNET
202.169.250.149:8111,HTTP,Indonesia,ID,🇮🇩,0,low,No,PT. Rabik Bangun Pertiwi
103.122.64.232:8080,HTTP,Indonesia,ID,🇮🇩,0,low,No,PT. Jinom Network Indonesia
175.158.44.21:3125,HTTP,Indonesia,ID,🇮🇩,0,low,No,CBNNAP
103.65.237.92:5678,HTTP,Indonesia,ID,🇮🇩,0,low,No,PT Berkah Solusi Teknologi Informasi
103.160.205.51:8080,HTTP,Indonesia,ID,🇮🇩,0,low,No,PRIME
121.101.129.131:8080,HTTP,Indonesia,ID,🇮🇩,0,low,No,PT SELARAS CITRA TERABIT
103.181.183.136:80,HTTP,Indonesia,ID,🇮🇩,0,low,No,PT Delta Awan Angkasa
202.154.19.153:8080,HTTP,Indonesia,ID,🇮🇩,0,low,No,DIGITNET
43.252.158.170:8989,HTTP,Indonesia,ID,🇮🇩,0,low,No,PT Blip Integrator Provider
103.208.102.93:1080,HTTP,Indonesia,ID,🇮🇩,0,low,No,PT Tidar Lintas Nusa
103.155.198.163:8080,HTTP,Indonesia,ID,🇮🇩,0,low,No,PT Lintas Jaringan Nusantara
157.20.252.170:8080,HTTP,Indonesia,ID,🇮🇩,0,low,No,PT.Global Media Data Prima
36.88.150.66:8080,HTTP,Indonesia,ID,🇮🇩,1,low,No,PT. Telekomunikasi Indonesia
103.125.38.50:8080,HTTP,Indonesia,ID,🇮🇩,6,low,No,PT. Eka Mas Republik
149.129.255.179:8018,HTTP,Indonesia,ID,🇮🇩,8,low,No,Alibaba.com Singapore E-Commerce Private Limited
