Proxy,Protocol,Country,Country Code,Flag,Fraud Score,Risk,VPN,ISP
103.48.71.126:83,HTTP,India,IN,🇮🇳,0,low,No,Country Online Services PVT LTD
103.199.215.43:6262,HTTP,India,IN,🇮🇳,0,low,No,RailTel Corporation of India Ltd.
124.108.19.6:9292,HTTP,India,IN,🇮🇳,0,low,No,Advantus Corporate Infoserv Private Ltd
103.48.71.114:83,HTTP,India,IN,🇮🇳,0,low,No,Country Online Services PVT LTD
219.65.73.80:80,HTTP,India,IN,🇮🇳,0,low,No,Tata Communications Limited
103.174.145.46:83,HTTP,India,IN,🇮🇳,0,low,No,Vaidik Netsol OPC PVT LTD
140.245.238.56:53,HTTP,India,IN,🇮🇳,0,low,Yes,Oracle Corporation
103.148.206.198:84,HTTP,India,IN,🇮🇳,0,low,No,Willaegis Online Private Limited
103.41.97.225:84,HTTP,India,IN,🇮🇳,8,low,No,Pioneer Elabs Ltd.
