Proxy,Protocol,Country,Country Code,Flag,Fraud Score,Risk,VPN,ISP
45.174.243.24:999,HTTP,Mexico,MX,🇲🇽,0,low,No,Sistemas Y Soluciones De Campeche SAS De CV
187.190.114.57:999,HTTP,Mexico,MX,🇲🇽,0,low,No,Total Play Telecomunicaciones SA De CV
38.58.66.175:999,HTTP,Mexico,MX,🇲🇽,0,low,No,Velocom SA De CV
201.140.185.41:8007,HTTP,Mexico,MX,🇲🇽,0,low,No,G Tel Comunicacion SAPI de CV - Sureste
204.157.104.16:999,HTTP,Mexico,MX,🇲🇽,0,low,No,Wistarip S De RL De CV
187.243.251.254:999,HTTP,Mexico,MX,🇲🇽,0,low,No,"Mega Cable, S.A. de C.V."
45.174.251.18:999,HTTP,Mexico,MX,🇲🇽,0,low,No,Wifmax S.A de C.V.
203.142.5.91:999,HTTP,Mexico,MX,🇲🇽,0,low,No,Onfiber SA De CV
38.49.152.198:999,HTTP,Mexico,MX,🇲🇽,0,low,No,IENTC S de RL de CV
38.65.138.42:999,HTTP,Mexico,MX,🇲🇽,0,low,No,IENTC S de RL de CV
38.49.150.131:999,HTTP,Mexico,MX,🇲🇽,0,low,No,IENTC S de RL de CV
45.174.168.28:999,HTTP,Mexico,MX,🇲🇽,0,low,No,Telecomunicaciones Otomies
45.174.243.128:999,HTTP,Mexico,MX,🇲🇽,0,low,No,Sistemas Y Soluciones De Campeche SAS De CV
38.43.88.102:999,HTTP,Mexico,MX,🇲🇽,0,low,No,Gotv S De RL De CV
38.19.36.56:999,HTTP,Mexico,MX,🇲🇽,0,low,No,TV CABLE DEL GUADIANA S.A DE C.V.
187.190.58.152:80,HTTP,Mexico,MX,🇲🇽,1,low,No,Total Play Telecomunicaciones SA De CV
201.151.225.14:999,HTTP,Mexico,MX,🇲🇽,1,low,No,"Alestra, S. de R.L. de C.V."
45.231.170.137:999,HTTP,Mexico,MX,🇲🇽,1,low,No,"GigNet, S.A. de C.V."
94.74.66.91:7890,HTTP,Mexico,MX,🇲🇽,3,low,No,Huawei International Pte. LTD
131.196.254.36:8080,HTTP,Mexico,MX,🇲🇽,33,medium,No,Truxgo S. de R.L de C.V
