Proxy,Protocol,Country,Country Code,Flag,Fraud Score,Risk,VPN,ISP
38.123.220.152:999,HTTP,Mexico,MX,🇲🇽,0,low,No,Cogent Communications
38.194.246.34:999,HTTP,Mexico,MX,🇲🇽,0,low,No,Cogent Communications
38.49.150.131:999,HTTP,Mexico,MX,🇲🇽,0,low,No,IENTC S de RL de CV
45.177.178.194:999,HTTP,Mexico,MX,🇲🇽,0,low,No,Wantelco SAS de CV
189.51.170.70:999,HTTP,Mexico,MX,🇲🇽,0,low,No,Comunicación por Fibra SA de CV
38.19.111.74:8080,HTTP,Mexico,MX,🇲🇽,0,low,No,Tecnologias FEM S.a.s De C.V
187.190.127.212:8081,HTTP,Mexico,MX,🇲🇽,1,low,No,Total Play Telecomunicaciones SA De CV
187.190.127.212:80,HTTP,Mexico,MX,🇲🇽,1,low,No,Total Play Telecomunicaciones SA De CV
94.74.66.91:7890,HTTP,Mexico,MX,🇲🇽,3,low,No,Huawei International Pte. LTD
