Proxy,Protocol,Country,Country Code,Flag,Fraud Score,Risk,VPN,ISP
45.168.239.58:999,HTTP,Mexico,MX,🇲🇽,0,low,No,Wantelco SAS de CV
38.56.249.14:999,HTTP,Mexico,MX,🇲🇽,0,low,No,Asespri Ethernet
177.229.193.18:999,HTTP,Mexico,MX,🇲🇽,1,low,No,"Mega Cable, S.A. de C.V."
187.190.58.152:8081,HTTP,Mexico,MX,🇲🇽,1,low,No,Total Play Telecomunicaciones SA De CV
187.243.251.254:999,HTTP,Mexico,MX,🇲🇽,1,low,No,"Mega Cable, S.A. de C.V."
201.163.82.73:999,HTTP,Mexico,MX,🇲🇽,2,low,No,"Alestra, S. de R.L. de C.V."
94.74.66.91:7890,HTTP,Mexico,MX,🇲🇽,3,low,No,Huawei International Pte. LTD
