Proxy,Protocol,Country,Country Code,Flag,Fraud Score,Risk,VPN,ISP
38.43.88.102:999,HTTP,Mexico,MX,🇲🇽,0,low,No,Gotv S De RL De CV
38.19.36.86:999,HTTP,Mexico,MX,🇲🇽,0,low,No,TV CABLE DEL GUADIANA S.A DE C.V.
45.174.168.16:999,HTTP,Mexico,MX,🇲🇽,0,low,No,Telecomunicaciones Otomies
206.135.24.11:999,HTTP,Mexico,MX,🇲🇽,0,low,No,GTT Americas
45.174.243.145:999,HTTP,Mexico,MX,🇲🇽,0,low,No,Sistemas Y Soluciones De Campeche SAS De CV
153.51.241.50:999,HTTP,Mexico,MX,🇲🇽,0,low,No,Javier Tamayo Garcia
45.168.239.58:999,HTTP,Mexico,MX,🇲🇽,0,low,No,Wantelco SAS de CV
168.121.242.91:999,HTTP,Mexico,MX,🇲🇽,0,low,No,Wifimax Connection S.a.s De C.V
38.210.179.146:999,HTTP,Mexico,MX,🇲🇽,0,low,No,Jair Lozano / Intercom Internet
38.123.220.105:999,HTTP,Mexico,MX,🇲🇽,0,low,No,Cogent Communications
45.7.64.8:999,HTTP,Mexico,MX,🇲🇽,0,low,No,Maysnet SA De CV
45.174.108.142:999,HTTP,Mexico,MX,🇲🇽,0,low,No,Iptvtel Comunicaciones S De RL De CV
38.49.148.149:999,HTTP,Mexico,MX,🇲🇽,0,low,No,IENTC S de RL de CV
153.51.241.38:999,HTTP,Mexico,MX,🇲🇽,0,low,No,Javier Tamayo Garcia
38.194.246.34:999,HTTP,Mexico,MX,🇲🇽,0,low,No,Cogent Communications
38.123.220.175:999,HTTP,Mexico,MX,🇲🇽,0,low,No,Cogent Communications
45.174.243.142:999,HTTP,Mexico,MX,🇲🇽,0,low,No,Sistemas Y Soluciones De Campeche SAS De CV
187.190.114.57:999,HTTP,Mexico,MX,🇲🇽,0,low,No,Total Play Telecomunicaciones SA De CV
201.140.185.41:8007,HTTP,Mexico,MX,🇲🇽,0,low,No,G Tel Comunicacion SAPI de CV - Sureste
38.49.142.174:999,HTTP,Mexico,MX,🇲🇽,0,low,No,IENTC S de RL de CV
131.196.245.120:999,HTTP,Mexico,MX,🇲🇽,0,low,No,Lantointernet SA De CV
177.242.137.182:999,HTTP,Mexico,MX,🇲🇽,1,low,No,"Mega Cable, S.A. de C.V."
200.92.201.126:999,HTTP,Mexico,MX,🇲🇽,1,low,No,"Mega Cable, S.A. de C.V."
187.251.230.15:8080,HTTP,Mexico,MX,🇲🇽,1,low,No,Total Play Telecomunicaciones SA De CV
189.193.225.86:999,HTTP,Mexico,MX,🇲🇽,1,low,No,"Mega Cable, S.A. de C.V."
160.34.208.144:80,HTTP,Mexico,MX,🇲🇽,2,low,No,Oracle Corporation
