Proxy,Protocol,Country,Country Code,Flag,Fraud Score,Risk,VPN,ISP
45.174.243.146:999,HTTP,Mexico,MX,🇲🇽,0,low,No,Sistemas Y Soluciones De Campeche SAS De CV
187.190.114.60:999,HTTP,Mexico,MX,🇲🇽,0,low,No,Total Play Telecomunicaciones SA De CV
153.51.241.50:999,HTTP,Mexico,MX,🇲🇽,0,low,No,Javier Tamayo Garcia
38.210.179.146:999,HTTP,Mexico,MX,🇲🇽,0,low,No,Jair Lozano / Intercom Internet
38.123.220.105:999,HTTP,Mexico,MX,🇲🇽,0,low,No,Cogent Communications
154.201.16.86:8081,HTTP,Mexico,MX,🇲🇽,0,low,No,"Señal Interactiva, S.A De C.V"
201.234.96.52:999,HTTP,Mexico,MX,🇲🇽,0,low,No,"Level 3 Communications, Inc."
45.7.64.8:999,HTTP,Mexico,MX,🇲🇽,0,low,No,Maysnet SA De CV
38.19.111.74:8080,HTTP,Mexico,MX,🇲🇽,0,low,No,Tecnologias FEM S.a.s De C.V
45.174.108.142:999,HTTP,Mexico,MX,🇲🇽,0,low,No,Iptvtel Comunicaciones S De RL De CV
153.51.241.38:999,HTTP,Mexico,MX,🇲🇽,0,low,No,Javier Tamayo Garcia
38.194.246.34:999,HTTP,Mexico,MX,🇲🇽,0,low,No,Cogent Communications
38.123.220.175:999,HTTP,Mexico,MX,🇲🇽,0,low,No,Cogent Communications
38.158.202.97:999,HTTP,Mexico,MX,🇲🇽,0,low,No,Onfiber SA De CV
45.190.76.17:999,HTTP,Mexico,MX,🇲🇽,0,low,No,Meta Networks SA De CV
38.194.251.246:999,HTTP,Mexico,MX,🇲🇽,0,low,No,Cogent Communications
201.46.85.20:8080,HTTP,Mexico,MX,🇲🇽,0,low,No,Comunicacion Digital De Sinaloa SA De CV
38.101.88.246:999,HTTP,Mexico,MX,🇲🇽,0,low,Yes,Rafael Rigoberto Lopez Orozco
204.157.104.16:999,HTTP,Mexico,MX,🇲🇽,0,low,No,Wistarip S De RL De CV
187.243.251.254:999,HTTP,Mexico,MX,🇲🇽,0,low,No,"Mega Cable, S.A. de C.V."
38.210.201.144:999,HTTP,Mexico,MX,🇲🇽,0,low,No,Cogent Communications
38.7.21.118:999,HTTP,Mexico,MX,🇲🇽,0,low,No,Internet Telefonia Y TV De Michoacan SA De CV
45.168.236.54:3128,HTTP,Mexico,MX,🇲🇽,0,low,No,Wantelco SAS de CV
189.51.170.70:999,HTTP,Mexico,MX,🇲🇽,0,low,No,Comunicación por Fibra SA de CV
38.7.23.138:999,HTTP,Mexico,MX,🇲🇽,0,low,No,Internet Telefonia Y TV De Michoacan SA De CV
207.248.108.129:20185,HTTP,Mexico,MX,🇲🇽,0,low,No,Redes y Comunicaciones de Michoacan S.A. de C.V.
186.96.15.70:8080,HTTP,Mexico,MX,🇲🇽,1,low,No,Total Play Telecomunicaciones SA De CV
189.137.80.194:8080,HTTP,Mexico,MX,🇲🇽,1,low,No,UNINET
187.188.15.249:8080,HTTP,Mexico,MX,🇲🇽,1,low,No,Total Play Telecomunicaciones SA De CV
187.251.230.15:8080,HTTP,Mexico,MX,🇲🇽,1,low,No,Total Play Telecomunicaciones SA De CV
187.190.114.59:999,HTTP,Mexico,MX,🇲🇽,1,low,No,Total Play Telecomunicaciones SA De CV
187.251.224.167:80,HTTP,Mexico,MX,🇲🇽,1,low,No,Total Play Telecomunicaciones SA De CV
201.164.60.74:999,HTTP,Mexico,MX,🇲🇽,1,low,No,"Mega Cable, S.A. de C.V."
187.190.58.152:80,HTTP,Mexico,MX,🇲🇽,1,low,No,Total Play Telecomunicaciones SA De CV
201.151.225.14:999,HTTP,Mexico,MX,🇲🇽,1,low,No,"Alestra, S. de R.L. de C.V."
94.74.66.91:7890,HTTP,Mexico,MX,🇲🇽,3,low,No,Huawei International Pte. LTD
148.224.7.58:999,HTTP,Mexico,MX,🇲🇽,3,low,No,Jorge Luis Torres Fernandez
147.78.1.53:8081,HTTP,Mexico,MX,🇲🇽,26,medium,No,ONEPROVIDER
