Proxy,Protocol,Country,Country Code,Flag,Fraud Score,Risk,VPN,ISP
45.174.243.145:999,HTTP,Mexico,MX,🇲🇽,0,low,No,Sistemas Y Soluciones De Campeche SAS De CV
38.49.142.174:999,HTTP,Mexico,MX,🇲🇽,0,low,No,IENTC S de RL de CV
206.135.32.70:999,HTTP,Mexico,MX,🇲🇽,0,low,No,GTT Americas
187.249.112.221:999,HTTP,Mexico,MX,🇲🇽,0,low,No,Transtelco Inc
45.174.168.8:999,HTTP,Mexico,MX,🇲🇽,0,low,No,Telecomunicaciones Otomies
187.250.1.225:999,HTTP,Mexico,MX,🇲🇽,0,low,No,Uninet S.A. de C.V.
148.224.57.55:999,HTTP,Mexico,MX,🇲🇽,0,low,No,Rafael Rigoberto Lopez Orozco
45.168.239.58:999,HTTP,Mexico,MX,🇲🇽,0,low,No,Wantelco SAS de CV
38.49.133.226:999,HTTP,Mexico,MX,🇲🇽,0,low,No,IENTC S de RL de CV
45.174.168.2:999,HTTP,Mexico,MX,🇲🇽,0,low,No,Telecomunicaciones Otomies
38.123.220.152:999,HTTP,Mexico,MX,🇲🇽,0,low,No,Cogent Communications
203.142.5.91:999,HTTP,Mexico,MX,🇲🇽,0,low,No,Onfiber SA De CV
38.123.220.105:999,HTTP,Mexico,MX,🇲🇽,0,low,No,Cogent Communications
201.140.185.41:8007,HTTP,Mexico,MX,🇲🇽,0,low,No,G Tel Comunicacion SAPI de CV - Sureste
38.123.220.175:999,HTTP,Mexico,MX,🇲🇽,0,low,No,Cogent Communications
38.7.23.118:999,HTTP,Mexico,MX,🇲🇽,0,low,No,Internet Telefonia Y TV De Michoacan SA De CV
187.243.251.254:999,HTTP,Mexico,MX,🇲🇽,0,low,No,"Mega Cable, S.A. de C.V."
38.123.220.59:999,HTTP,Mexico,MX,🇲🇽,0,low,No,Cogent Communications
206.135.38.38:999,HTTP,Mexico,MX,🇲🇽,0,low,No,GTT Americas
201.46.85.20:8080,HTTP,Mexico,MX,🇲🇽,0,low,No,Comunicacion Digital De Sinaloa SA De CV
207.248.108.129:20185,HTTP,Mexico,MX,🇲🇽,0,low,No,Redes y Comunicaciones de Michoacan S.A. de C.V.
38.194.246.34:999,HTTP,Mexico,MX,🇲🇽,0,low,No,Cogent Communications
201.150.6.201:8081,HTTP,Mexico,MX,🇲🇽,0,low,No,Administradora de Servicios de Internet Sandur S.A. de C.V.
201.159.102.17:8081,HTTP,Mexico,MX,🇲🇽,0,low,No,Administradora de Servicios de Internet Sandur S.A. de C.V.
38.123.220.173:999,HTTP,Mexico,MX,🇲🇽,0,low,No,Cogent Communications
45.174.243.146:999,HTTP,Mexico,MX,🇲🇽,0,low,No,Sistemas Y Soluciones De Campeche SAS De CV
201.77.110.177:999,HTTP,Mexico,MX,🇲🇽,0,low,No,Nidix Networks S.a. De C.V.
38.65.174.107:999,HTTP,Mexico,MX,🇲🇽,0,low,No,Wantelco SAS de CV
206.135.43.62:999,HTTP,Mexico,MX,🇲🇽,0,low,No,GTT Americas
189.193.225.86:999,HTTP,Mexico,MX,🇲🇽,1,low,No,"Mega Cable, S.A. de C.V."
187.188.169.140:999,HTTP,Mexico,MX,🇲🇽,1,low,No,Total Play Telecomunicaciones SA De CV
177.242.137.182:999,HTTP,Mexico,MX,🇲🇽,1,low,No,"Mega Cable, S.A. de C.V."
45.231.170.137:999,HTTP,Mexico,MX,🇲🇽,2,low,No,"GigNet, S.A. de C.V."
201.163.82.73:999,HTTP,Mexico,MX,🇲🇽,2,low,No,"Alestra, S. de R.L. de C.V."
