Proxy,Protocol,Country,Country Code,Flag,Fraud Score,Risk,VPN,ISP
38.7.21.118:999,HTTP,Mexico,MX,🇲🇽,0,low,No,Internet Telefonia Y TV De Michoacan SA De CV
187.248.75.114:8081,HTTP,Mexico,MX,🇲🇽,0,low,No,Transtelco Inc
45.174.168.38:999,HTTP,Mexico,MX,🇲🇽,0,low,No,Telecomunicaciones Otomies
38.19.111.74:8080,HTTP,Mexico,MX,🇲🇽,0,low,No,Tecnologias FEM S.a.s De C.V
153.51.241.50:999,HTTP,Mexico,MX,🇲🇽,0,low,No,Javier Tamayo Garcia
38.194.246.34:999,HTTP,Mexico,MX,🇲🇽,0,low,No,Cogent Communications
45.5.93.30:7070,HTTP,Mexico,MX,🇲🇽,0,low,No,"Señal Interactiva, S.A De C.V"
45.174.243.144:999,HTTP,Mexico,MX,🇲🇽,0,low,No,Sistemas Y Soluciones De Campeche SAS De CV
187.249.112.221:999,HTTP,Mexico,MX,🇲🇽,0,low,No,Transtelco Inc
201.159.99.37:8081,HTTP,Mexico,MX,🇲🇽,0,low,No,Administradora de Servicios de Internet Sandur S.A. de C.V.
45.174.168.253:999,HTTP,Mexico,MX,🇲🇽,0,low,No,Telecomunicaciones Otomies
203.142.5.91:999,HTTP,Mexico,MX,🇲🇽,0,low,No,Onfiber SA De CV
154.201.16.86:8081,HTTP,Mexico,MX,🇲🇽,0,low,No,"Señal Interactiva, S.A De C.V"
189.51.170.74:999,HTTP,Mexico,MX,🇲🇽,0,low,No,Comunicación por Fibra SA de CV
38.58.64.139:999,HTTP,Mexico,MX,🇲🇽,0,low,No,Velocom SA De CV
200.92.201.126:999,HTTP,Mexico,MX,🇲🇽,1,low,No,"Mega Cable, S.A. de C.V."
187.190.58.124:8080,HTTP,Mexico,MX,🇲🇽,1,low,No,Total Play Telecomunicaciones SA De CV
160.34.208.144:80,HTTP,Mexico,MX,🇲🇽,2,low,No,Oracle Corporation
148.224.14.252:999,HTTP,Mexico,MX,🇲🇽,3,low,No,Jorge Luis Torres Fernandez
148.224.14.254:999,HTTP,Mexico,MX,🇲🇽,3,low,No,Jorge Luis Torres Fernandez
147.78.1.53:8081,HTTP,Mexico,MX,🇲🇽,24,medium,No,ONEPROVIDER
