Proxy,Protocol,Country,Country Code,Flag,Fraud Score,Risk,VPN,ISP
37.230.58.20:999,HTTP,Paraguay,PY,🇵🇾,0,low,No,Aranda Cardozo Lider Ramon
170.245.133.49:999,HTTP,Paraguay,PY,🇵🇾,0,low,No,"MACHADO BAEZ, NERY JAVIER"
190.110.226.122:80,HTTP,Paraguay,PY,🇵🇾,0,low,No,TECNOLOGIA EN ELECTRONICA E INFORMATICA SOCIEDAD ANONIMA (T.E.I.S.A)
24.152.40.49:8080,HTTP,Paraguay,PY,🇵🇾,0,low,No,TV MAX CABLE S.A.
181.78.95.59:999,HTTP,Paraguay,PY,🇵🇾,0,low,No,Ufinet Paraguay S.A
170.245.132.86:999,HTTP,Paraguay,PY,🇵🇾,0,low,No,"MACHADO BAEZ, NERY JAVIER"
170.245.132.81:999,HTTP,Paraguay,PY,🇵🇾,0,low,No,"MACHADO BAEZ, NERY JAVIER"
