Proxy,Protocol,Country,Country Code,Flag,Fraud Score,Risk,VPN,ISP
8.219.97.248:80,HTTP,Singapore,SG,🇸🇬,0,low,No,Alibaba Cloud (Singapore) Private Limited
47.237.107.41:3129,HTTP,Singapore,SG,🇸🇬,0,low,Yes,"Alibaba (US) Technology Co., Ltd."
47.237.107.41:8096,HTTP,Singapore,SG,🇸🇬,0,low,Yes,"Alibaba (US) Technology Co., Ltd."
31.57.178.195:8080,HTTP,Singapore,SG,🇸🇬,0,low,No,PT Perwira Media Solusi
45.77.246.231:80,HTTP,Singapore,SG,🇸🇬,45,medium,No,The Constant Company
178.128.59.180:18080,HTTP,Singapore,SG,🇸🇬,61,high,Yes,"DigitalOcean, LLC"
