Proxy,Protocol,Country,Country Code,Flag,Fraud Score,Risk,VPN,ISP
8.219.97.248:80,HTTP,Singapore,SG,🇸🇬,0,low,No,Alibaba Cloud (Singapore) Private Limited
47.237.113.119:10,HTTP,Singapore,SG,🇸🇬,1,low,Yes,"Alibaba (US) Technology Co., Ltd."
43.160.255.142:7890,HTTP,Singapore,SG,🇸🇬,1,low,No,Aceville Pte.ltd
47.237.113.119:8081,HTTP,Singapore,SG,🇸🇬,1,low,Yes,"Alibaba (US) Technology Co., Ltd."
43.128.114.142:7890,HTTP,Singapore,SG,🇸🇬,1,low,No,Shenzhen Tencent Computer Systems Company Limited
140.245.99.105:7890,HTTP,Singapore,SG,🇸🇬,2,low,Yes,Oracle Corporation
62.146.233.116:8881,HTTP,Singapore,SG,🇸🇬,14,low,No,Contabo Asia Private Limited
178.128.59.180:18080,HTTP,Singapore,SG,🇸🇬,59,medium,Yes,"DigitalOcean, LLC"
