Proxy,Protocol,Country,Country Code,Flag,Fraud Score,Risk,VPN,ISP
202.28.194.139:31280,HTTP,Thailand,TH,🇹🇭,0,low,Yes,Office of Info.Tech. Admin. for Educational Development
47.81.56.193:8888,HTTP,Thailand,TH,🇹🇭,0,low,Yes,Alibaba.com LLC
8.213.197.208:9098,HTTP,Thailand,TH,🇹🇭,5,low,No,"Alibaba (US) Technology Co., Ltd."
8.213.197.208:9000,HTTP,Thailand,TH,🇹🇭,5,low,No,"Alibaba (US) Technology Co., Ltd."
8.213.222.247:3128,HTTP,Thailand,TH,🇹🇭,5,low,No,"Alibaba (US) Technology Co., Ltd."
171.4.70.45:8080,HTTP,Thailand,TH,🇹🇭,6,low,No,Triple T Broadband Public Company Limited
58.136.170.250:8080,HTTP,Thailand,TH,🇹🇭,6,low,No,AIS-Fibre
