Proxy,Protocol,Country,Country Code,Flag,Fraud Score,Risk,VPN,ISP
8.211.195.173:9797,SOCKS4,United Kingdom,GB,🇬🇧,2,low,No,"Alibaba (US) Technology Co., Ltd."
5.189.153.6:10001,SOCKS4,United Kingdom,GB,🇬🇧,14,low,No,Contabo GmbH
130.49.187.61:1081,SOCKS4,United Kingdom,GB,🇬🇧,25,medium,No,Global Connectivity Solutions LLP
130.49.187.61:1082,SOCKS4,United Kingdom,GB,🇬🇧,25,medium,No,Global Connectivity Solutions LLP
81.168.119.85:443,SOCKS4,United Kingdom,GB,🇬🇧,100,very_high,Yes,Iomart Cloud Services Limited
