Proxy,Protocol,Country,Country Code,Flag,Fraud Score,Risk,VPN,ISP
157.10.97.83:2021,SOCKS4,Indonesia,ID,🇮🇩,0,low,No,PT Lintas Jaringan Nusantara
103.160.205.244:8080,SOCKS4,Indonesia,ID,🇮🇩,0,low,No,PRIME
103.233.103.241:4153,SOCKS4,Indonesia,ID,🇮🇩,0,low,No,PT. Tujuh Ion Indonesia
115.85.86.114:5678,SOCKS4,Indonesia,ID,🇮🇩,0,low,No,Sudirman Central Business District
103.102.141.39:4145,SOCKS4,Indonesia,ID,🇮🇩,0,low,No,PT. PALAPA RING BARAT
103.123.249.15:5678,SOCKS4,Indonesia,ID,🇮🇩,0,low,No,PT Mora Telematika Indonesia
103.172.71.204:1080,SOCKS4,Indonesia,ID,🇮🇩,0,low,No,AZNET
8.215.12.103:8009,SOCKS4,Indonesia,ID,🇮🇩,0,low,No,Alibaba Cloud (Singapore) Private Limited
36.95.39.122:1080,SOCKS4,Indonesia,ID,🇮🇩,0,low,No,Telekomunikasi Indonesia
149.129.226.9:1081,SOCKS4,Indonesia,ID,🇮🇩,9,low,No,Alibaba.com Singapore E-Commerce Private Limited
149.129.226.9:41,SOCKS4,Indonesia,ID,🇮🇩,9,low,No,Alibaba.com Singapore E-Commerce Private Limited
