Proxy,Protocol,Country,Country Code,Flag,Fraud Score,Risk,VPN,ISP
151.232.18.66:5678,SOCKS4,Iran,IR,🇮🇷,0,low,No,Iran Telecommunication Company PJS
87.107.68.231:1081,SOCKS4,Iran,IR,🇮🇷,0,low,Yes,Soroush Rasanheh Company Ltd
2.188.210.83:4443,SOCKS4,Iran,IR,🇮🇷,0,low,No,Respina Networks & Beyond PJSC
2.188.210.5:4443,SOCKS4,Iran,IR,🇮🇷,0,low,No,Respina Networks & Beyond PJSC
85.133.248.62:10808,SOCKS4,Iran,IR,🇮🇷,0,low,No,Pars Abr Toseeh Ertebatat LTD
85.133.206.47:1083,SOCKS4,Iran,IR,🇮🇷,0,low,No,DyarWeb Information Technology Ltd
85.133.206.47:1081,SOCKS4,Iran,IR,🇮🇷,0,low,No,DyarWeb Information Technology Ltd
