Proxy,Protocol,Country,Country Code,Flag,Fraud Score,Risk,VPN,ISP
185.32.4.65:4153,SOCKS4,Poland,PL,🇵🇱,0,low,No,AS Consulting Sp. z o. o.
185.147.69.48:1080,SOCKS4,Poland,PL,🇵🇱,0,low,No,Prymas Inwestycje Spolka Z Ograniczona Odpowiedzialnoscia Spolka Komandytowa
194.59.186.35:1080,SOCKS4,Poland,PL,🇵🇱,0,low,No,Aeza International LTD
91.150.189.122:60647,SOCKS4,Poland,PL,🇵🇱,0,low,No,Skyware Sp. z o.o.
212.126.5.249:42344,SOCKS4,Poland,PL,🇵🇱,0,low,No,"Institute of Bioorganic Chemistry Polish Academy of Science, Poznan Supercomput"
46.171.28.162:59311,SOCKS4,Poland,PL,🇵🇱,1,low,No,Orange Polska Spolka Akcyjna
77.83.246.110:2000,SOCKS4,Poland,PL,🇵🇱,28,medium,No,Global Connectivity Solutions LLP
92.118.205.175:80,SOCKS4,Poland,PL,🇵🇱,37,medium,No,"BrainStorm Network, Inc"
