Proxy,Protocol,Country,Country Code,Flag,Fraud Score,Risk,VPN,ISP
1.20.254.32:4153,SOCKS4,Thailand,TH,🇹🇭,0,low,No,TOT Public Company Limited
119.63.95.3:4153,SOCKS4,Thailand,TH,🇹🇭,0,low,Yes,"United Information Highway Co., Ltd."
203.172.120.179:1080,SOCKS4,Thailand,TH,🇹🇭,0,low,No,sinokor1
1.179.151.165:31948,SOCKS4,Thailand,TH,🇹🇭,1,low,No,TOT Public Company Limited
8.213.197.208:8081,SOCKS4,Thailand,TH,🇹🇭,3,low,No,"Alibaba (US) Technology Co., Ltd."
183.88.248.232:4145,SOCKS4,Thailand,TH,🇹🇭,6,low,No,Triple T Broadband Public Company Limited
