Proxy,Protocol,Country,Country Code,Flag,Fraud Score,Risk,VPN,ISP
160.22.200.60:69,SOCKS5,Indonesia,ID,🇮🇩,0,low,No,PT Karangmukti Global Netmedia
103.134.220.49:1080,SOCKS5,Indonesia,ID,🇮🇩,0,low,No,PT GLOBAL MEDIA PRATAMA SOLUSINDO
202.43.165.140:10802,SOCKS5,Indonesia,ID,🇮🇩,0,low,Yes,DTPNet
103.165.128.74:1080,SOCKS5,Indonesia,ID,🇮🇩,0,low,No,PT iForte Global Internet
103.189.63.149:53053,SOCKS5,Indonesia,ID,🇮🇩,0,low,No,PT Blip Integrator Provider
103.119.60.219:1080,SOCKS5,Indonesia,ID,🇮🇩,6,low,No,PT. Eka Mas Republik
