Proxy,Protocol,Country,Country Code,Flag,Fraud Score,Risk,VPN,ISP
103.103.146.149:7080,SOCKS5,Indonesia,ID,🇮🇩,0,low,No,ARTAMEDIANET
103.242.105.199:8199,SOCKS5,Indonesia,ID,🇮🇩,0,low,No,PT Lintas Jaringan Nusantara
103.189.63.149:53053,SOCKS5,Indonesia,ID,🇮🇩,0,low,No,PT Blip Integrator Provider
103.119.60.219:1080,SOCKS5,Indonesia,ID,🇮🇩,6,low,No,PT. Eka Mas Republik
149.129.255.179:1080,SOCKS5,Indonesia,ID,🇮🇩,8,low,No,Alibaba.com Singapore E-Commerce Private Limited
149.129.255.179:8081,SOCKS5,Indonesia,ID,🇮🇩,8,low,No,Alibaba.com Singapore E-Commerce Private Limited
