Proxy,Protocol,Country,Country Code,Flag,Fraud Score,Risk,VPN,ISP
163.61.70.4:9000,SOCKS5,Vietnam,VN,🇻🇳,0,low,No,Gold Key Real Estate Investment Company Limited
160.250.54.5:9000,SOCKS5,Vietnam,VN,🇻🇳,0,low,No,Sandclock Service Trading Company Limited
160.250.54.4:9000,SOCKS5,Vietnam,VN,🇻🇳,0,low,No,Sandclock Service Trading Company Limited
160.22.17.4:9988,SOCKS5,Vietnam,VN,🇻🇳,0,low,No,VNPT Corp
118.70.151.55:1080,SOCKS5,Vietnam,VN,🇻🇳,1,low,No,Vietnam Internet Network Information Center
116.97.240.124:1543,SOCKS5,Vietnam,VN,🇻🇳,2,low,No,Viettel Group
